[32m[I 2026-08-23 07:46:04,433][0m Trial 15 finished with value: 0.6291553945242685 and parameters: {'dropout': 0.6111164991859303, 'num_filters': 574, 'num_blocks': 3, 'kernel_set': 1, 'lr': 0.00021409142679949515, 'weight_decay': 0.0001253877833724882, 'l1_lambda': 8.81822559596418e-08, 'gradient_clip': 3.460319047692151, 'loss_type': 'focal', 'focal_gamma': 4.931633336031594, 'optimizer_type': 'adamw', 'momentum': 0.749606111493829, 'scheduler_type': 'plateau'}. Best is trial 13 with value: 0.643738903566273.[0m
  [Trial 015] value=0.6292
[32m[I 2026-08-23 07:47:08,353][0m Trial 16 finished with value: 0.6345259283250004 and parameters: {'dropout': 0.5875766508057871, 'num_filters': 55, 'num_blocks': 3, 'kernel_set': 0, 'lr': 5.583006216293863e-05, 'weight_decay': 0.004923492783205243, 'l1_lambda': 0.006491753359056848, 'gradient_clip': 4.4937608149250625, 'loss_type': 'focal', 'focal_gamma': 3.6431165651610327, 'optimizer_type': 'adamw', 'momentum': 0.8618217440661541, 'scheduler_type': 'cosine'}. Best is trial 13 with value: 0.643738903566273.[0m
  [Trial 016] value=0.6345
[32m[I 2026-08-23 07:48:04,470][0m Trial 17 finished with value: 0.6496646759240476 and parameters: {'dropout': 0.4285903668878812, 'num_filters': 99, 'num_blocks': 10, 'kernel_set': 0, 'lr': 0.0011499287750861339, 'weight_decay': 0.00010457386702385975, 'l1_lambda': 1.735202947192544e-06, 'gradient_clip': 3.2356092720009144, 'loss_type': 'focal', 'focal_gamma': 1.6774844879224868, 'optimizer_type': 'adamw', 'momentum': 0.7335278089912306, 'scheduler_type': 'plateau'}. Best is trial 17 with value: 0.6496646759240476.[0m
  [Trial 017] value=0.6497
[32m[I 2026-08-23 07:49:10,550][0m Trial 18 finished with value: 0.6448219309472951 and parameters: {'dropout': 0.3985803299910122, 'num_filters': 97, 'num_blocks': 11, 'kernel_set': 0, 'lr': 0.00508838040717383, 'weight_decay': 0.062089982803708234, 'l1_lambda': 1.987887326623581e-06, 'gradient_clip': 4.8975272325092885, 'loss_type': 'focal', 'focal_gamma': 1.1792723464201649, 'optimizer_type': 'adamw', 'momentum': 0.8059461728972978, 'scheduler_type': 'plateau'}. Best is trial 17 with value: 0.6496646759240476.[0m
  [Trial 018] value=0.6448
[32m[I 2026-08-23 07:50:29,256][0m Trial 19 finished with value: 0.6378601532209123 and parameters: {'dropout': 0.3993618087745037, 'num_filters': 92, 'num_blocks': 10, 'kernel_set': 2, 'lr': 0.005290104219379584, 'weight_decay': 0.009150466867540638, 'l1_lambda': 3.491424682366755e-05, 'gradient_clip': 4.861369532457814, 'loss_type': 'focal', 'focal_gamma': 1.1041187866328508, 'optimizer_type': 'adamw', 'momentum': 0.7957820643600595, 'scheduler_type': 'plateau'}. Best is trial 17 with value: 0.6496646759240476.[0m
  [Trial 019] value=0.6379
[32m[I 2026-08-23 07:51:12,217][0m Trial 20 finished with value: 0.0 and parameters: {'dropout': 0.32530366019986506, 'num_filters': 75, 'num_blocks': 15, 'kernel_set': 1, 'lr': 0.03796475259835788, 'weight_decay': 0.05414629893530585, 'l1_lambda': 3.9895820328307646e-05, 'gradient_clip': 4.175290820259768, 'loss_type': 'focal', 'focal_gamma': 1.8997616115619889, 'optimizer_type': 'rmsprop', 'momentum': 0.860338344159115, 'scheduler_type': 'plateau'}. Best is trial 17 with value: 0.6496646759240476.[0m
  [Trial 020] value=0.0000
[32m[I 2026-08-23 07:52:00,704][0m Trial 21 finished with value: 0.649799836787303 and parameters: {'dropout': 0.4526308117925478, 'num_filters': 115, 'num_blocks': 10, 'kernel_set': 0, 'lr': 0.0014947705194358913, 'weight_decay': 0.0015639506825842907, 'l1_lambda': 2.0466087976736267e-06, 'gradient_clip': 3.3470512268176957, 'loss_type': 'focal', 'focal_gamma': 1.9145632354270694, 'optimizer_type': 'adamw', 'momentum': 0.7381418908451132, 'scheduler_type': 'plateau'}. Best is trial 21 with value: 0.649799836787303.[0m
  [Trial 021] value=0.6498
[32m[I 2026-08-23 07:52:54,905][0m Trial 22 finished with value: 0.6470055994300372 and parameters: {'dropout': 0.43278965521049906, 'num_filters': 123, 'num_blocks': 10, 'kernel_set': 0, 'lr': 0.0011274550730231395, 'weight_decay': 0.0016899804790794831, 'l1_lambda': 1.1400980928714158e-06, 'gradient_clip': 3.2345603099089972, 'loss_type': 'focal', 'focal_gamma': 1.861069428888397, 'optimizer_type': 'adamw', 'momentum': 0.8099653152942288, 'scheduler_type': 'plateau'}. Best is trial 21 with value: 0.649799836787303.[0m
  [Trial 022] value=0.6470
[32m[I 2026-08-23 07:53:57,897][0m Trial 23 finished with value: 0.6451164052298006 and parameters: {'dropout': 0.48248157749682613, 'num_filters': 132, 'num_blocks': 9, 'kernel_set': 0, 'lr': 0.00131989154017759, 'weight_decay': 0.0017748666808262241, 'l1_lambda': 4.632415375841705e-07, 'gradient_clip': 3.1143031457554686, 'loss_type': 'focal', 'focal_gamma': 1.8947609888871788, 'optimizer_type': 'adamw', 'momentum': 0.7679590542896064, 'scheduler_type': 'plateau'}. Best is trial 21 with value: 0.649799836787303.[0m
  [Trial 023] value=0.6451
[32m[I 2026-08-23 07:55:05,760][0m Trial 24 finished with value: 0.640577825600741 and parameters: {'dropout': 0.44889136429410914, 'num_filters': 40, 'num_blocks': 14, 'kernel_set': 0, 'lr': 0.0013358283001113364, 'weight_decay': 0.001991482266276271, 'l1_lambda': 1.6181581771167515e-05, 'gradient_clip': 2.4022204354843355, 'loss_type': 'focal', 'focal_gamma': 1.8331294101233186, 'optimizer_type': 'adamw', 'momentum': 0.7363411074469867, 'scheduler_type': 'plateau'}. Best is trial 21 with value: 0.649799836787303.[0m
  [Trial 024] value=0.6406
[32m[I 2026-08-23 07:55:56,391][0m Trial 25 finished with value: 0.647864628331342 and parameters: {'dropout': 0.5423790873117715, 'num_filters': 71, 'num_blocks': 10, 'kernel_set': 0, 'lr': 0.0007446647108005261, 'weight_decay': 0.00014960716345821252, 'l1_lambda': 6.421153603682045e-06, 'gradient_clip': 3.550530172204794, 'loss_type': 'focal', 'focal_gamma': 1.5155204302311494, 'optimizer_type': 'adamw', 'momentum': 0.7306445306709318, 'scheduler_type': 'plateau'}. Best is trial 21 with value: 0.649799836787303.[0m
  [Trial 025] value=0.6479
[32m[I 2026-08-23 07:57:08,021][0m Trial 26 finished with value: 0.6502049738615848 and parameters: {'dropout': 0.5471535592812656, 'num_filters': 51, 'num_blocks': 8, 'kernel_set': 0, 'lr': 0.0026554789332261875, 'weight_decay': 0.00019940275550781104, 'l1_lambda': 0.00014843259243046698, 'gradient_clip': 3.8639363063196592, 'loss_type': 'focal', 'focal_gamma': 1.5715997108151296, 'optimizer_type': 'adamw', 'momentum': 0.7197338496379584, 'scheduler_type': 'plateau'}. Best is trial 26 with value: 0.6502049738615848.[0m
  [Trial 026] value=0.6502
[32m[I 2026-08-23 07:58:07,702][0m Trial 27 finished with value: 0.6571112473848415 and parameters: {'dropout': 0.5426711797690842, 'num_filters': 46, 'num_blocks': 6, 'kernel_set': 0, 'lr': 0.002379492150129019, 'weight_decay': 1.8675815128704608e-06, 'l1_lambda': 0.0002565328048122303, 'gradient_clip': 4.109150906783816, 'loss_type': 'focal', 'focal_gamma': 2.262957322949588, 'optimizer_type': 'adamw', 'momentum': 0.7656748517237771, 'scheduler_type': 'plateau'}. Best is trial 27 with value: 0.6571112473848415.[0m
  [Trial 027] value=0.6571
[32m[I 2026-08-23 07:59:05,263][0m Trial 28 finished with value: 0.6449516725820936 and parameters: {'dropout': 0.5562305639792271, 'num_filters': 46, 'num_blocks': 6, 'kernel_set': 1, 'lr': 0.0028617858132582463, 'weight_decay': 1.6976704940356766e-06, 'l1_lambda': 0.0007365282333224481, 'gradient_clip': 4.046828359090579, 'loss_type': 'focal', 'focal_gamma': 2.259303083166057, 'optimizer_type': 'rmsprop', 'momentum': 0.7618766422093007, 'scheduler_type': 'plateau'}. Best is trial 27 with value: 0.6571112473848415.[0m
  [Trial 028] value=0.6450
[32m[I 2026-08-23 08:00:37,138][0m Trial 29 finished with value: 0.6358953736953966 and parameters: {'dropout': 0.5466862508712029, 'num_filters': 32, 'num_blocks': 8, 'kernel_set': 2, 'lr': 0.005075596065243105, 'weight_decay': 2.6787052617509716e-06, 'l1_lambda': 0.0008203696217621431, 'gradient_clip': 3.996240725934782, 'loss_type': 'ce', 'focal_gamma': 2.202178471802446, 'optimizer_type': 'adamw', 'momentum': 0.7202413818672648, 'scheduler_type': 'plateau'}. Best is trial 27 with value: 0.6571112473848415.[0m
  [Trial 029] value=0.6359
[32m[I 2026-08-23 08:04:49,272][0m Trial 0 finished with value: 0.6042887446752111 and parameters: {'dropout': 0.19881553049466472, 'num_channels': 944, 'kernel_size': 3, 'depth': 8, 'lr': 0.0015700565292934116, 'weight_decay': 4.301437652564222e-07, 'l1_lambda': 0.00010582851543185218, 'gradient_clip': 4.160150315623036, 'loss_type': 'focal', 'focal_gamma': 2.1539234765876714, 'optimizer_type': 'sgd', 'momentum': 0.8626155113041608, 'scheduler_type': 'cosine'}. Best is trial 0 with value: 0.6042887446752111.[0m
  [Trial 000] value=0.6043
[32m[I 2026-08-23 08:05:31,552][0m Trial 1 finished with value: 0.608325585130956 and parameters: {'dropout': 0.2692935425537769, 'num_channels': 38, 'kernel_size': 7, 'depth': 2, 'lr': 0.00012802318109191255, 'weight_decay': 0.0011212410031210512, 'l1_lambda': 9.624326978269073e-08, 'gradient_clip': 3.064628490029697, 'loss_type': 'ce', 'focal_gamma': 1.1841411283900598, 'optimizer_type': 'sgd', 'momentum': 0.8216704249388508, 'scheduler_type': 'cosine'}. Best is trial 1 with value: 0.608325585130956.[0m
  [Trial 001] value=0.6083
[32m[I 2026-08-23 08:06:28,006][0m Trial 2 finished with value: 0.6230416701828879 and parameters: {'dropout': 0.35038085384965734, 'num_channels': 105, 'kernel_size': 11, 'depth': 7, 'lr': 5.46837187196866e-05, 'weight_decay': 0.06000988263374868, 'l1_lambda': 9.144794150914823e-07, 'gradient_clip': 4.740129944561835, 'loss_type': 'ce', 'focal_gamma': 4.258533215924715, 'optimizer_type': 'adamw', 'momentum': 0.7121663993004538, 'scheduler_type': 'cosine'}. Best is trial 2 with value: 0.6230416701828879.[0m
  [Trial 002] value=0.6230
[33m[W 2026-08-23 08:06:32,974][0m Trial 3 failed with parameters: {'dropout': 0.373564259385403, 'num_channels': 759, 'kernel_size': 3, 'depth': 12, 'lr': 0.00013012868692571, 'weight_decay': 8.204789045016532e-07, 'l1_lambda': 0.00010223952779472398, 'gradient_clip': 1.657748820187969, 'loss_type': 'ce', 'focal_gamma': 3.447263285093295, 'optimizer_type': 'adamw', 'momentum': 0.9728988834447, 'scheduler_type': 'plateau'} because of the following error: OutOfMemoryError('CUDA out of memory. Tried to allocate 762.00 MiB. GPU 0 has a total capacity of 7.61 GiB of which 194.81 MiB is free. Process 763453 has 304.00 MiB memory in use. Including non-PyTorch memory, this process has 4.63 GiB memory in use. Process 766008 has 2.49 GiB memory in use. Of the allocated memory 3.15 GiB is allocated by PyTorch, and 1.33 GiB is reserved by PyTorch but unallocated. If reserved but unallocated memory is large try setting PYTORCH_CUDA_ALLOC_CONF=expandable_segments:True to avoid fragmentation.  See documentation for Memory Management  (https://pytorch.org/docs/stable/notes/cuda.html#environment-variables)').[0m
Traceback (most recent call last):
  File [35m"/slurm_shared/home/andrepedroribeiro@av.it.pt/inMotion/.venv/lib/python3.13/site-packages/optuna/study/_optimize.py"[0m, line [35m206[0m, in [35m_run_trial[0m
    value_or_values = func(trial)
  File [35m"/slurm_shared/home/andrepedroribeiro@av.it.pt/inMotion/dl/optimization.py"[0m, line [35m359[0m, in [35mobjective[0m
    return _train_and_eval(
        model, config, tr_loader, val_loader, trial, f"hpo_{model_type}", mode=hpo_mode
    )
  File [35m"/slurm_shared/home/andrepedroribeiro@av.it.pt/inMotion/dl/optimization.py"[0m, line [35m173[0m, in [35m_train_and_eval[0m
    result = trainer.fit(model, tr_loader, val_loader)
  File [35m"/slurm_shared/home/andrepedroribeiro@av.it.pt/inMotion/dl/training.py"[0m, line [35m218[0m, in [35mfit[0m
    tr_loss, _, _ = [31mself._step[0m[1;31m(model, train_loader, criterion, optimizer, train=True)[0m
                    [31m~~~~~~~~~~[0m[1;31m^^^^^^^^^^^^^^^^^^^^^^^^^^^^^^^^^^^^^^^^^^^^^^^^^^^^^^^[0m
  File [35m"/slurm_shared/home/andrepedroribeiro@av.it.pt/inMotion/dl/training.py"[0m, line [35m103[0m, in [35m_step[0m
    logits = model(X_mixed)
  File [35m"/slurm_shared/home/andrepedroribeiro@av.it.pt/inMotion/.venv/lib/python3.13/site-packages/torch/nn/modules/module.py"[0m, line [35m1775[0m, in [35m_wrapped_call_impl[0m
    return [31mself._call_impl[0m[1;31m(*args, **kwargs)[0m
           [31m~~~~~~~~~~~~~~~[0m[1;31m^^^^^^^^^^^^^^^^^[0m
  File [35m"/slurm_shared/home/andrepedroribeiro@av.it.pt/inMotion/.venv/lib/python3.13/site-packages/torch/nn/modules/module.py"[0m, line [35m1786[0m, in [35m_call_impl[0m
    return forward_call(*args, **kwargs)
  File [35m"/slurm_shared/home/andrepedroribeiro@av.it.pt/inMotion/dl/models/tcn.py"[0m, line [35m122[0m, in [35mforward[0m
    x = self.network(x)  # → (B, num_channels, T)
  File [35m"/slurm_shared/home/andrepedroribeiro@av.it.pt/inMotion/.venv/lib/python3.13/site-packages/torch/nn/modules/module.py"[0m, line [35m1775[0m, in [35m_wrapped_call_impl[0m
    return [31mself._call_impl[0m[1;31m(*args, **kwargs)[0m
           [31m~~~~~~~~~~~~~~~[0m[1;31m^^^^^^^^^^^^^^^^^[0m
  File [35m"/slurm_shared/home/andrepedroribeiro@av.it.pt/inMotion/.venv/lib/python3.13/site-packages/torch/nn/modules/module.py"[0m, line [35m1786[0m, in [35m_call_impl[0m
    return forward_call(*args, **kwargs)
  File [35m"/slurm_shared/home/andrepedroribeiro@av.it.pt/inMotion/.venv/lib/python3.13/site-packages/torch/nn/modules/container.py"[0m, line [35m250[0m, in [35mforward[0m
    input = module(input)
  File [35m"/slurm_shared/home/andrepedroribeiro@av.it.pt/inMotion/.venv/lib/python3.13/site-packages/torch/nn/modules/module.py"[0m, line [35m1775[0m, in [35m_wrapped_call_impl[0m
    return [31mself._call_impl[0m[1;31m(*args, **kwargs)[0m
           [31m~~~~~~~~~~~~~~~[0m[1;31m^^^^^^^^^^^^^^^^^[0m
  File [35m"/slurm_shared/home/andrepedroribeiro@av.it.pt/inMotion/.venv/lib/python3.13/site-packages/torch/nn/modules/module.py"[0m, line [35m1786[0m, in [35m_call_impl[0m
    return forward_call(*args, **kwargs)
  File [35m"/slurm_shared/home/andrepedroribeiro@av.it.pt/inMotion/dl/models/tcn.py"[0m, line [35m77[0m, in [35mforward[0m
    out = self.act(self.bn2([31mself.conv2[0m[1;31m(out)[0m))
                            [31m~~~~~~~~~~[0m[1;31m^^^^^[0m
  File [35m"/slurm_shared/home/andrepedroribeiro@av.it.pt/inMotion/.venv/lib/python3.13/site-packages/torch/nn/modules/module.py"[0m, line [35m1775[0m, in [35m_wrapped_call_impl[0m
    return [31mself._call_impl[0m[1;31m(*args, **kwargs)[0m
           [31m~~~~~~~~~~~~~~~[0m[1;31m^^^^^^^^^^^^^^^^^[0m
  File [35m"/slurm_shared/home/andrepedroribeiro@av.it.pt/inMotion/.venv/lib/python3.13/site-packages/torch/nn/modules/module.py"[0m, line [35m1786[0m, in [35m_call_impl[0m
    return forward_call(*args, **kwargs)
  File [35m"/slurm_shared/home/andrepedroribeiro@av.it.pt/inMotion/dl/models/tcn.py"[0m, line [35m44[0m, in [35mforward[0m
    x = F.pad(x, (self.causal_pad, 0))
  File [35m"/slurm_shared/home/andrepedroribeiro@av.it.pt/inMotion/.venv/lib/python3.13/site-packages/torch/nn/functional.py"[0m, line [35m5294[0m, in [35mpad[0m
    return [31mtorch._C._nn.pad[0m[1;31m(input, pad, mode, value)[0m
           [31m~~~~~~~~~~~~~~~~[0m[1;31m^^^^^^^^^^^^^^^^^^^^^^^^^[0m
[1;35mtorch.OutOfMemoryError[0m: [35mCUDA out of memory. Tried to allocate 762.00 MiB. GPU 0 has a total capacity of 7.61 GiB of which 194.81 MiB is free. Process 763453 has 304.00 MiB memory in use. Including non-PyTorch memory, this process has 4.63 GiB memory in use. Process 766008 has 2.49 GiB memory in use. Of the allocated memory 3.15 GiB is allocated by PyTorch, and 1.33 GiB is reserved by PyTorch but unallocated. If reserved but unallocated memory is large try setting PYTORCH_CUDA_ALLOC_CONF=expandable_segments:True to avoid fragmentation.  See documentation for Memory Management  (https://pytorch.org/docs/stable/notes/cuda.html#environment-variables)[0m
[33m[W 2026-08-23 08:06:32,993][0m Trial 3 failed with value None.[0m
[32m[I 2026-08-23 08:07:33,686][0m Trial 0 finished with value: 0.6406335037914656 and parameters: {'dropout': 0.11483638203172099, 'd_model': 128, 'n_heads': 8, 'num_layers': 3, 'lr': 7.47106751618923e-05, 'weight_decay': 2.284643358581103e-06, 'l1_lambda': 0.00022262776861209935, 'gradient_clip': 4.917506848721367, 'loss_type': 'focal', 'focal_gamma': 2.5527805908986037, 'optimizer_type': 'adamw', 'momentum': 0.7732971075099038, 'scheduler_type': 'cosine'}. Best is trial 0 with value: 0.6406335037914656.[0m
  [Trial 000] value=0.6406
[32m[I 2026-08-23 08:09:07,310][0m Trial 1 finished with value: 0.6217554245056115 and parameters: {'dropout': 0.05783045221341225, 'd_model': 512, 'n_heads': 2, 'num_layers': 5, 'lr': 0.0006793902038610901, 'weight_decay': 0.00044001666198890173, 'l1_lambda': 2.258875321503911e-06, 'gradient_clip': 2.275266867412544, 'loss_type': 'focal', 'focal_gamma': 1.0008160625098848, 'optimizer_type': 'adamw', 'momentum': 0.96036644009333, 'scheduler_type': 'plateau'}. Best is trial 0 with value: 0.6406335037914656.[0m
  [Trial 001] value=0.6218
[32m[I 2026-08-23 08:10:51,762][0m Trial 2 finished with value: 0.6301415980033737 and parameters: {'dropout': 0.1575636972463501, 'd_model': 256, 'n_heads': 16, 'num_layers': 7, 'lr': 0.000388518551234455, 'weight_decay': 0.007598468636467506, 'l1_lambda': 5.057782355699517e-05, 'gradient_clip': 3.9746266944155364, 'loss_type': 'focal', 'focal_gamma': 3.039553748162483, 'optimizer_type': 'adamw', 'momentum': 0.9103883806853531, 'scheduler_type': 'plateau'}. Best is trial 0 with value: 0.6406335037914656.[0m
  [Trial 002] value=0.6301
[32m[I 2026-08-23 08:12:10,777][0m Trial 3 finished with value: 0.5828821607540412 and parameters: {'dropout': 0.2900954282887401, 'd_model': 32, 'n_heads': 16, 'num_layers': 7, 'lr': 6.047229347943545e-05, 'weight_decay': 2.739287525458065e-05, 'l1_lambda': 0.006042125316658616, 'gradient_clip': 3.194502370772908, 'loss_type': 'focal', 'focal_gamma': 1.9205783174515556, 'optimizer_type': 'adamw', 'momentum': 0.9857427570800212, 'scheduler_type': 'plateau'}. Best is trial 0 with value: 0.6406335037914656.[0m
  [Trial 003] value=0.5829
[32m[I 2026-08-23 08:12:56,919][0m Trial 4 finished with value: 0.6377672106403655 and parameters: {'dropout': 0.2171991984727792, 'd_model': 512, 'n_heads': 2, 'num_layers': 2, 'lr': 0.00018577965266863234, 'weight_decay': 0.03809447670736578, 'l1_lambda': 8.58970383850752e-06, 'gradient_clip': 2.3008206309782167, 'loss_type': 'ce', 'focal_gamma': 2.28553059140093, 'optimizer_type': 'adamw', 'momentum': 0.8180186196727945, 'scheduler_type': 'plateau'}. Best is trial 0 with value: 0.6406335037914656.[0m
  [Trial 004] value=0.6378
[32m[I 2026-08-23 08:13:46,793][0m Trial 5 finished with value: 0.6390031638435962 and parameters: {'dropout': 0.0970751010058165, 'd_model': 128, 'n_heads': 2, 'num_layers': 4, 'lr': 0.00022963202976554882, 'weight_decay': 0.00033509316744721534, 'l1_lambda': 6.722682207772485e-06, 'gradient_clip': 1.3559344464128937, 'loss_type': 'focal', 'focal_gamma': 3.7857644715837764, 'optimizer_type': 'adamw', 'momentum': 0.9192206278471973, 'scheduler_type': 'plateau'}. Best is trial 0 with value: 0.6406335037914656.[0m
  [Trial 005] value=0.6390
[32m[I 2026-08-23 08:14:26,662][0m Trial 6 finished with value: 0.632691382056391 and parameters: {'dropout': 0.06256034348378818, 'd_model': 64, 'n_heads': 16, 'num_layers': 2, 'lr': 0.00014614653696855251, 'weight_decay': 0.0001887085441518464, 'l1_lambda': 1.3677333034182783e-05, 'gradient_clip': 1.0597731261521344, 'loss_type': 'ce', 'focal_gamma': 1.7484656946147914, 'optimizer_type': 'adamw', 'momentum': 0.9372275828263337, 'scheduler_type': 'plateau'}. Best is trial 0 with value: 0.6406335037914656.[0m
  [Trial 006] value=0.6327
[32m[I 2026-08-23 08:16:05,221][0m Trial 7 finished with value: 0.6265202021996239 and parameters: {'dropout': 0.1891779452071794, 'd_model': 512, 'n_heads': 2, 'num_layers': 5, 'lr': 0.0006275000699181007, 'weight_decay': 0.000293298220801246, 'l1_lambda': 4.781003843996447e-06, 'gradient_clip': 1.0785210295548804, 'loss_type': 'focal', 'focal_gamma': 1.854516891206778, 'optimizer_type': 'adamw', 'momentum': 0.7252882823195778, 'scheduler_type': 'cosine'}. Best is trial 0 with value: 0.6406335037914656.[0m
  [Trial 007] value=0.6265
[32m[I 2026-08-23 08:16:44,839][0m Trial 8 finished with value: 0.5959228538276325 and parameters: {'dropout': 0.2038084848909374, 'd_model': 512, 'n_heads': 2, 'num_layers': 2, 'lr': 0.0027336714072526812, 'weight_decay': 0.00030954603609507203, 'l1_lambda': 1.5716004940503282e-07, 'gradient_clip': 4.169714094660778, 'loss_type': 'focal', 'focal_gamma': 2.026228412940785, 'optimizer_type': 'adamw', 'momentum': 0.9704306790480801, 'scheduler_type': 'cosine'}. Best is trial 0 with value: 0.6406335037914656.[0m
  [Trial 008] value=0.5959
[32m[I 2026-08-23 08:17:28,840][0m Trial 9 finished with value: 0.6448752629734973 and parameters: {'dropout': 0.11630014810324545, 'd_model': 128, 'n_heads': 8, 'num_layers': 5, 'lr': 0.0002846939315271429, 'weight_decay': 3.865165807545676e-06, 'l1_lambda': 2.959645888681419e-06, 'gradient_clip': 4.6195471402097565, 'loss_type': 'focal', 'focal_gamma': 2.7512586056303077, 'optimizer_type': 'adamw', 'momentum': 0.7647253301767688, 'scheduler_type': 'cosine'}. Best is trial 9 with value: 0.6448752629734973.[0m
  [Trial 009] value=0.6449
