[32m[I 2026-08-23 10:45:08,305][0m Trial 28 finished with value: 0.6292005893944289 and parameters: {'dropout': 0.051684774532094815, 'd_model': 64, 'd_state': 15, 'num_layers': 3, 'expand': 4, 'mimo_rank': 8, 'lr': 0.0013817052093097165, 'weight_decay': 0.026828620214418723, 'l1_lambda': 4.38367581543511e-08, 'gradient_clip': 2.2568730105800388, 'loss_type': 'ce', 'focal_gamma': 4.052700778045318, 'optimizer_type': 'adamw', 'momentum': 0.7344813178365034, 'scheduler_type': 'cosine'}. Best is trial 20 with value: 0.6519896422680298.[0m
  [Trial 028] value=0.6292
[32m[I 2026-08-23 10:51:07,702][0m Trial 29 finished with value: 0.6281713106211935 and parameters: {'dropout': 0.3202550301753573, 'd_model': 64, 'd_state': 11, 'num_layers': 6, 'expand': 4, 'mimo_rank': 8, 'lr': 0.002335755166408414, 'weight_decay': 4.5471319853402674e-05, 'l1_lambda': 7.809726041689074e-07, 'gradient_clip': 0.9917964137966692, 'loss_type': 'ce', 'focal_gamma': 3.469762540027034, 'optimizer_type': 'adamw', 'momentum': 0.7281155360988202, 'scheduler_type': 'cosine'}. Best is trial 20 with value: 0.6519896422680298.[0m
  [Trial 029] value=0.6282
