Device pool: ['cuda:0']  (parallel workers: 1)
Dataset: (3511, 10, 4)  classes: ['AA', 'AB', 'BA', 'BB']  seed: 42

[Phase 1] 7 models × 1 GPU(s)

[Phase 1.5] Metadata-fusion models (2) — noise + path context

[Phase 2] Building ensembles…
  [Stacking_All] training meta-learner…
  [Stacking_All] test_mcc=0.6320

[Phase 3] HPO (7 studies) + NAS across 1 GPU(s)…
[32m[I 2026-08-23 06:15:07,963][0m Trial 0 finished with value: 0.0 and parameters: {'dropout': 0.18168970418997205, 'hidden_size': 339, 'num_layers': 4, 'bidirectional': False, 'use_attention': False, 'lr': 0.001150399563229431, 'weight_decay': 0.004296800145628113, 'l1_lambda': 0.0008275616469915468, 'gradient_clip': 4.2479405702450865, 'loss_type': 'ce', 'focal_gamma': 4.988480374432744, 'optimizer_type': 'rmsprop', 'momentum': 0.8392297512903574, 'scheduler_type': 'plateau'}. Best is trial 0 with value: 0.0.[0m
  [Trial 000] value=0.0000
[32m[I 2026-08-23 06:15:28,324][0m Trial 1 finished with value: 0.0 and parameters: {'dropout': 0.26229564203751027, 'hidden_size': 158, 'num_layers': 7, 'bidirectional': False, 'use_attention': True, 'lr': 0.02067134942454963, 'weight_decay': 0.09042540486531689, 'l1_lambda': 1.198668735498422e-08, 'gradient_clip': 0.5151317563139235, 'loss_type': 'ce', 'focal_gamma': 1.9584885170728552, 'optimizer_type': 'sgd', 'momentum': 0.8270482193314611, 'scheduler_type': 'cosine'}. Best is trial 0 with value: 0.0.[0m
  [Trial 001] value=0.0000
[32m[I 2026-08-23 06:16:05,167][0m Trial 2 finished with value: 0.5406494256112021 and parameters: {'dropout': 0.5486890029118497, 'hidden_size': 128, 'num_layers': 2, 'bidirectional': True, 'use_attention': False, 'lr': 6.780698828853648e-05, 'weight_decay': 0.06667360875064798, 'l1_lambda': 7.253516180162579e-07, 'gradient_clip': 1.0032532562469965, 'loss_type': 'ce', 'focal_gamma': 3.868317996495782, 'optimizer_type': 'sgd', 'momentum': 0.8800814765138506, 'scheduler_type': 'cosine'}. Best is trial 2 with value: 0.5406494256112021.[0m
  [Trial 002] value=0.5406
[32m[I 2026-08-23 06:16:31,943][0m Trial 3 finished with value: 0.0 and parameters: {'dropout': 0.13044819023724674, 'hidden_size': 43, 'num_layers': 9, 'bidirectional': True, 'use_attention': False, 'lr': 0.00966248256425456, 'weight_decay': 0.0003822332883413037, 'l1_lambda': 0.0030838599849153897, 'gradient_clip': 4.4546925946657945, 'loss_type': 'ce', 'focal_gamma': 3.1548088199253206, 'optimizer_type': 'rmsprop', 'momentum': 0.8527068187415404, 'scheduler_type': 'plateau'}. Best is trial 2 with value: 0.5406494256112021.[0m
  [Trial 003] value=0.0000
[32m[I 2026-08-23 06:17:59,669][0m Trial 4 finished with value: 0.6428695683994606 and parameters: {'dropout': 0.05250376209276179, 'hidden_size': 193, 'num_layers': 7, 'bidirectional': True, 'use_attention': False, 'lr': 0.0011248308400196563, 'weight_decay': 0.009505724708838722, 'l1_lambda': 7.537892362283098e-05, 'gradient_clip': 1.8557647517097526, 'loss_type': 'ce', 'focal_gamma': 4.277274715408868, 'optimizer_type': 'adamw', 'momentum': 0.7380746667232208, 'scheduler_type': 'cosine'}. Best is trial 4 with value: 0.6428695683994606.[0m
  [Trial 004] value=0.6429
[32m[I 2026-08-23 06:18:43,020][0m Trial 5 finished with value: 0.6023377639200939 and parameters: {'dropout': 0.3624857822675537, 'hidden_size': 114, 'num_layers': 6, 'bidirectional': True, 'use_attention': True, 'lr': 0.00029259731775944237, 'weight_decay': 0.005902450372477438, 'l1_lambda': 1.4932664934667504e-06, 'gradient_clip': 1.4896578810525007, 'loss_type': 'focal', 'focal_gamma': 1.031753705716406, 'optimizer_type': 'rmsprop', 'momentum': 0.9196712942171138, 'scheduler_type': 'plateau'}. Best is trial 4 with value: 0.6428695683994606.[0m
  [Trial 005] value=0.6023
[32m[I 2026-08-23 06:19:15,517][0m Trial 6 finished with value: 0.5934662573867647 and parameters: {'dropout': 0.3559707225078052, 'hidden_size': 51, 'num_layers': 6, 'bidirectional': False, 'use_attention': True, 'lr': 5.555460038025907e-05, 'weight_decay': 0.008177285878418126, 'l1_lambda': 4.239859063601758e-06, 'gradient_clip': 2.425156813677618, 'loss_type': 'ce', 'focal_gamma': 4.186587255647458, 'optimizer_type': 'rmsprop', 'momentum': 0.7509142751022073, 'scheduler_type': 'plateau'}. Best is trial 4 with value: 0.6428695683994606.[0m
  [Trial 006] value=0.5935
[32m[I 2026-08-23 06:20:09,324][0m Trial 7 finished with value: 0.6140608284119766 and parameters: {'dropout': 0.6798807796129247, 'hidden_size': 64, 'num_layers': 8, 'bidirectional': False, 'use_attention': True, 'lr': 0.0003472451055422789, 'weight_decay': 0.0044155351230379, 'l1_lambda': 4.950484843094635e-07, 'gradient_clip': 2.1129638976544296, 'loss_type': 'ce', 'focal_gamma': 1.2968241345546367, 'optimizer_type': 'adamw', 'momentum': 0.8939540288195078, 'scheduler_type': 'cosine'}. Best is trial 4 with value: 0.6428695683994606.[0m
  [Trial 007] value=0.6141
[32m[I 2026-08-23 06:20:38,456][0m Trial 8 finished with value: 0.281930129843376 and parameters: {'dropout': 0.365511148559932, 'hidden_size': 701, 'num_layers': 5, 'bidirectional': False, 'use_attention': False, 'lr': 0.0002656786722323641, 'weight_decay': 4.580904658384176e-05, 'l1_lambda': 0.007445949290207372, 'gradient_clip': 1.4564937735920584, 'loss_type': 'focal', 'focal_gamma': 3.468048217904743, 'optimizer_type': 'rmsprop', 'momentum': 0.8893343041773814, 'scheduler_type': 'plateau'}. Best is trial 4 with value: 0.6428695683994606.[0m
  [Trial 008] value=0.2819
[32m[I 2026-08-23 06:21:11,637][0m Trial 9 finished with value: 0.22539828275303675 and parameters: {'dropout': 0.6731579596300344, 'hidden_size': 259, 'num_layers': 9, 'bidirectional': False, 'use_attention': False, 'lr': 0.021779461092317494, 'weight_decay': 1.471375105133454e-06, 'l1_lambda': 6.806766285609796e-06, 'gradient_clip': 1.5121530056079642, 'loss_type': 'ce', 'focal_gamma': 4.47184998876242, 'optimizer_type': 'adamw', 'momentum': 0.7717116712472634, 'scheduler_type': 'cosine'}. Best is trial 4 with value: 0.6428695683994606.[0m
  [Trial 009] value=0.2254
[32m[I 2026-08-23 06:21:35,760][0m Trial 10 finished with value: 0.6170072311755725 and parameters: {'dropout': 0.05787053566635445, 'hidden_size': 768, 'num_layers': 1, 'bidirectional': True, 'use_attention': False, 'lr': 0.006335028711117909, 'weight_decay': 2.5493412055240994e-07, 'l1_lambda': 0.00014543995392082433, 'gradient_clip': 3.4548967489191025, 'loss_type': 'focal', 'focal_gamma': 2.246761998233808, 'optimizer_type': 'adamw', 'momentum': 0.9819455217082451, 'scheduler_type': 'cosine'}. Best is trial 4 with value: 0.6428695683994606.[0m
  [Trial 010] value=0.6170
[32m[I 2026-08-23 06:22:08,697][0m Trial 11 finished with value: 0.6351263931320346 and parameters: {'dropout': 0.11227908720365946, 'hidden_size': 832, 'num_layers': 1, 'bidirectional': True, 'use_attention': False, 'lr': 0.0036577219991326742, 'weight_decay': 1.0549462098359081e-07, 'l1_lambda': 0.0001392071942133202, 'gradient_clip': 3.522562453708462, 'loss_type': 'focal', 'focal_gamma': 2.410355784813081, 'optimizer_type': 'adamw', 'momentum': 0.9821962294923289, 'scheduler_type': 'cosine'}. Best is trial 4 with value: 0.6428695683994606.[0m
  [Trial 011] value=0.6351
[32m[I 2026-08-23 06:23:04,299][0m Trial 12 finished with value: 0.6312664557967294 and parameters: {'dropout': 0.050791246056120926, 'hidden_size': 413, 'num_layers': 3, 'bidirectional': True, 'use_attention': False, 'lr': 0.002224171593914127, 'weight_decay': 1.8129436649432386e-05, 'l1_lambda': 0.0001302236848780649, 'gradient_clip': 3.324650158547687, 'loss_type': 'focal', 'focal_gamma': 2.379509125450728, 'optimizer_type': 'adamw', 'momentum': 0.7181787567367004, 'scheduler_type': 'cosine'}. Best is trial 4 with value: 0.6428695683994606.[0m
  [Trial 012] value=0.6313
[32m[I 2026-08-23 06:24:06,052][0m Trial 13 finished with value: 0.12126698834250083 and parameters: {'dropout': 0.2114518123771945, 'hidden_size': 458, 'num_layers': 10, 'bidirectional': True, 'use_attention': False, 'lr': 0.0019437117886541813, 'weight_decay': 5.6465910543908475e-06, 'l1_lambda': 8.610087645334025e-05, 'gradient_clip': 3.053706572216163, 'loss_type': 'focal', 'focal_gamma': 2.6944937505674207, 'optimizer_type': 'adamw', 'momentum': 0.9781005968860538, 'scheduler_type': 'cosine'}. Best is trial 4 with value: 0.6428695683994606.[0m
  [Trial 013] value=0.1213
[32m[I 2026-08-23 06:28:33,693][0m Trial 14 finished with value: 0.631264211547667 and parameters: {'dropout': 0.12746490929854423, 'hidden_size': 1022, 'num_layers': 4, 'bidirectional': True, 'use_attention': False, 'lr': 0.0043745946717098855, 'weight_decay': 0.0003143237111600228, 'l1_lambda': 4.667423201933793e-05, 'gradient_clip': 3.841679782423596, 'loss_type': 'focal', 'focal_gamma': 1.8056414159273482, 'optimizer_type': 'adamw', 'momentum': 0.7954865308171141, 'scheduler_type': 'cosine'}. Best is trial 4 with value: 0.6428695683994606.[0m
  [Trial 014] value=0.6313
[32m[I 2026-08-23 06:29:12,539][0m Trial 15 finished with value: 0.6074880220515637 and parameters: {'dropout': 0.4761475059325945, 'hidden_size': 244, 'num_layers': 1, 'bidirectional': True, 'use_attention': False, 'lr': 0.0006720464192763752, 'weight_decay': 2.8963132757442527e-07, 'l1_lambda': 0.0007601787542142918, 'gradient_clip': 2.5861393918876594, 'loss_type': 'focal', 'focal_gamma': 3.3724591878260344, 'optimizer_type': 'adamw', 'momentum': 0.7000566654425535, 'scheduler_type': 'cosine'}. Best is trial 4 with value: 0.6428695683994606.[0m
  [Trial 015] value=0.6075
[32m[I 2026-08-23 06:29:37,001][0m Trial 16 finished with value: 0.0 and parameters: {'dropout': 0.27008477247121626, 'hidden_size': 86, 'num_layers': 7, 'bidirectional': True, 'use_attention': False, 'lr': 0.04236962949151323, 'weight_decay': 0.0006552588297831173, 'l1_lambda': 1.7814695384414523e-05, 'gradient_clip': 4.999100040860713, 'loss_type': 'ce', 'focal_gamma': 2.7904933819095494, 'optimizer_type': 'adamw', 'momentum': 0.940642255249401, 'scheduler_type': 'cosine'}. Best is trial 4 with value: 0.6428695683994606.[0m
  [Trial 016] value=0.0000
[32m[I 2026-08-23 06:30:42,197][0m Trial 17 finished with value: 0.6091426462246328 and parameters: {'dropout': 0.12673245615919645, 'hidden_size': 546, 'num_layers': 3, 'bidirectional': True, 'use_attention': False, 'lr': 0.003956543170435036, 'weight_decay': 1.0573461023032721e-07, 'l1_lambda': 1.0263507386876092e-08, 'gradient_clip': 2.154133863536016, 'loss_type': 'focal', 'focal_gamma': 4.9318040772406855, 'optimizer_type': 'sgd', 'momentum': 0.8079318449917389, 'scheduler_type': 'cosine'}. Best is trial 4 with value: 0.6428695683994606.[0m
  [Trial 017] value=0.6091
[32m[I 2026-08-23 06:31:22,386][0m Trial 18 finished with value: 0.5994923596135453 and parameters: {'dropout': 0.2778902156018318, 'hidden_size': 219, 'num_layers': 5, 'bidirectional': True, 'use_attention': True, 'lr': 0.0010734621474445712, 'weight_decay': 2.3748580861504205e-06, 'l1_lambda': 0.0007799993210892111, 'gradient_clip': 3.0036101621485995, 'loss_type': 'focal', 'focal_gamma': 3.6320654292773558, 'optimizer_type': 'adamw', 'momentum': 0.7560586613947018, 'scheduler_type': 'cosine'}. Best is trial 4 with value: 0.6428695683994606.[0m
  [Trial 018] value=0.5995
[32m[I 2026-08-23 06:32:14,064][0m Trial 19 finished with value: 0.6404333214426274 and parameters: {'dropout': 0.43541335353692456, 'hidden_size': 32, 'num_layers': 7, 'bidirectional': True, 'use_attention': False, 'lr': 0.00015096367078694118, 'weight_decay': 0.00010907462888901184, 'l1_lambda': 1.1530856633351812e-07, 'gradient_clip': 3.90850029604707, 'loss_type': 'ce', 'focal_gamma': 4.380384431991902, 'optimizer_type': 'adamw', 'momentum': 0.9267420449306518, 'scheduler_type': 'cosine'}. Best is trial 4 with value: 0.6428695683994606.[0m
  [Trial 019] value=0.6404
[32m[I 2026-08-23 06:33:14,646][0m Trial 20 finished with value: 0.5670678071600186 and parameters: {'dropout': 0.46259632058581324, 'hidden_size': 33, 'num_layers': 7, 'bidirectional': True, 'use_attention': False, 'lr': 9.775638800909238e-05, 'weight_decay': 0.023321493825275826, 'l1_lambda': 1.8853329855313232e-07, 'gradient_clip': 4.138769822426314, 'loss_type': 'ce', 'focal_gamma': 4.460916191414933, 'optimizer_type': 'sgd', 'momentum': 0.934040142982721, 'scheduler_type': 'cosine'}. Best is trial 4 with value: 0.6428695683994606.[0m
  [Trial 020] value=0.5671
[32m[I 2026-08-23 06:33:58,518][0m Trial 21 finished with value: 0.6437879388429185 and parameters: {'dropout': 0.4596469943874021, 'hidden_size': 84, 'num_layers': 8, 'bidirectional': True, 'use_attention': False, 'lr': 0.00015976713884185357, 'weight_decay': 8.275064400805843e-05, 'l1_lambda': 8.559055892859375e-08, 'gradient_clip': 3.7390260900963943, 'loss_type': 'ce', 'focal_gamma': 4.152892067119244, 'optimizer_type': 'adamw', 'momentum': 0.954741194136875, 'scheduler_type': 'cosine'}. Best is trial 21 with value: 0.6437879388429185.[0m
  [Trial 021] value=0.6438
[32m[I 2026-08-23 06:35:02,379][0m Trial 22 finished with value: 0.6401057020699569 and parameters: {'dropout': 0.47838101684521617, 'hidden_size': 70, 'num_layers': 8, 'bidirectional': True, 'use_attention': False, 'lr': 0.00013952970460222268, 'weight_decay': 7.391844236832687e-05, 'l1_lambda': 5.3279419959277235e-08, 'gradient_clip': 4.723994067200424, 'loss_type': 'ce', 'focal_gamma': 3.9546380244597064, 'optimizer_type': 'adamw', 'momentum': 0.9496861572800218, 'scheduler_type': 'cosine'}. Best is trial 21 with value: 0.6437879388429185.[0m
  [Trial 022] value=0.6401
[32m[I 2026-08-23 06:36:12,193][0m Trial 23 finished with value: 0.6422402215453277 and parameters: {'dropout': 0.5546422708309527, 'hidden_size': 95, 'num_layers': 8, 'bidirectional': True, 'use_attention': False, 'lr': 0.00014182289340194655, 'weight_decay': 0.0006535979368326062, 'l1_lambda': 7.99874128872395e-08, 'gradient_clip': 3.804151217788182, 'loss_type': 'ce', 'focal_gamma': 4.586737677550985, 'optimizer_type': 'adamw', 'momentum': 0.9170259353359775, 'scheduler_type': 'cosine'}. Best is trial 21 with value: 0.6437879388429185.[0m
  [Trial 023] value=0.6422
[32m[I 2026-08-23 06:37:01,756][0m Trial 24 finished with value: 0.6480663148845063 and parameters: {'dropout': 0.5758391000435389, 'hidden_size': 97, 'num_layers': 10, 'bidirectional': True, 'use_attention': False, 'lr': 0.000527479958879752, 'weight_decay': 0.0011280683014668299, 'l1_lambda': 3.989258321350673e-08, 'gradient_clip': 2.983033863512633, 'loss_type': 'ce', 'focal_gamma': 4.741306565082592, 'optimizer_type': 'adamw', 'momentum': 0.8624595958740351, 'scheduler_type': 'cosine'}. Best is trial 24 with value: 0.6480663148845063.[0m
  [Trial 024] value=0.6481
[32m[I 2026-08-23 06:39:20,423][0m Trial 25 finished with value: 0.6525553707409127 and parameters: {'dropout': 0.6020656824491462, 'hidden_size': 164, 'num_layers': 10, 'bidirectional': True, 'use_attention': False, 'lr': 0.0005797678928062529, 'weight_decay': 0.00173239114946793, 'l1_lambda': 2.111670892286821e-06, 'gradient_clip': 1.9547627862337211, 'loss_type': 'ce', 'focal_gamma': 4.722942291054052, 'optimizer_type': 'adamw', 'momentum': 0.8578180864205545, 'scheduler_type': 'cosine'}. Best is trial 25 with value: 0.6525553707409127.[0m
  [Trial 025] value=0.6526
[32m[I 2026-08-23 06:40:39,632][0m Trial 26 finished with value: 0.6505296740965808 and parameters: {'dropout': 0.5822504139790065, 'hidden_size': 149, 'num_layers': 10, 'bidirectional': True, 'use_attention': True, 'lr': 0.0004961242292096364, 'weight_decay': 0.0014453848098783147, 'l1_lambda': 2.7409908170846462e-08, 'gradient_clip': 2.9302746641617046, 'loss_type': 'ce', 'focal_gamma': 4.717262498124586, 'optimizer_type': 'adamw', 'momentum': 0.8667608125462113, 'scheduler_type': 'plateau'}. Best is trial 25 with value: 0.6525553707409127.[0m
  [Trial 026] value=0.6505
[32m[I 2026-08-23 06:41:50,750][0m Trial 27 finished with value: 0.6501059807633147 and parameters: {'dropout': 0.6122839741577238, 'hidden_size': 137, 'num_layers': 10, 'bidirectional': True, 'use_attention': True, 'lr': 0.000612051552432302, 'weight_decay': 0.001681668838169464, 'l1_lambda': 3.056004220577905e-08, 'gradient_clip': 2.645197572313433, 'loss_type': 'ce', 'focal_gamma': 4.741653244132881, 'optimizer_type': 'adamw', 'momentum': 0.8668728546519735, 'scheduler_type': 'plateau'}. Best is trial 25 with value: 0.6525553707409127.[0m
  [Trial 027] value=0.6501
[32m[I 2026-08-23 06:43:05,609][0m Trial 28 finished with value: 0.6567976195443301 and parameters: {'dropout': 0.6102977331717401, 'hidden_size': 154, 'num_layers': 10, 'bidirectional': True, 'use_attention': True, 'lr': 0.0005699207308767803, 'weight_decay': 0.002205785772566318, 'l1_lambda': 2.4579289219148008e-08, 'gradient_clip': 2.6900557398984746, 'loss_type': 'ce', 'focal_gamma': 4.757436726779424, 'optimizer_type': 'adamw', 'momentum': 0.8689278730920402, 'scheduler_type': 'plateau'}. Best is trial 28 with value: 0.6567976195443301.[0m
  [Trial 028] value=0.6568
[32m[I 2026-08-23 06:44:03,453][0m Trial 29 finished with value: 0.5092190423820285 and parameters: {'dropout': 0.6143621929256705, 'hidden_size': 335, 'num_layers': 9, 'bidirectional': False, 'use_attention': True, 'lr': 0.0009582445381075088, 'weight_decay': 0.0018969142309353162, 'l1_lambda': 2.4658350902367896e-07, 'gradient_clip': 2.156053165456541, 'loss_type': 'ce', 'focal_gamma': 4.940222396163614, 'optimizer_type': 'sgd', 'momentum': 0.8289362938181162, 'scheduler_type': 'plateau'}. Best is trial 28 with value: 0.6567976195443301.[0m
  [Trial 029] value=0.5092
[32m[I 2026-08-23 06:47:32,732][0m Trial 0 finished with value: 0.6095439130442272 and parameters: {'dropout': 0.6874080694435154, 'hidden_size': 216, 'num_layers': 7, 'bidirectional': False, 'use_attention': True, 'lr': 0.004818420279804031, 'weight_decay': 0.0006641791481818664, 'l1_lambda': 2.398651089392628e-07, 'gradient_clip': 3.840800733662546, 'loss_type': 'focal', 'focal_gamma': 2.1102167291610727, 'optimizer_type': 'adamw', 'momentum': 0.7610275544681602, 'scheduler_type': 'plateau'}. Best is trial 0 with value: 0.6095439130442272.[0m
  [Trial 000] value=0.6095
[32m[I 2026-08-23 06:48:23,781][0m Trial 1 finished with value: 0.6519980945725803 and parameters: {'dropout': 0.35677364161640257, 'hidden_size': 60, 'num_layers': 6, 'bidirectional': True, 'use_attention': True, 'lr': 0.0004316493152049512, 'weight_decay': 4.052249860066504e-05, 'l1_lambda': 5.88699303642045e-06, 'gradient_clip': 4.063997308008293, 'loss_type': 'ce', 'focal_gamma': 3.3769107086596173, 'optimizer_type': 'adamw', 'momentum': 0.9319685004139701, 'scheduler_type': 'cosine'}. Best is trial 1 with value: 0.6519980945725803.[0m
  [Trial 001] value=0.6520
[32m[I 2026-08-23 06:50:32,366][0m Trial 2 finished with value: 0.0 and parameters: {'dropout': 0.633984457835124, 'hidden_size': 787, 'num_layers': 6, 'bidirectional': True, 'use_attention': False, 'lr': 0.009458531924842455, 'weight_decay': 0.045400976837805855, 'l1_lambda': 0.0001398829488030684, 'gradient_clip': 0.8991153415921069, 'loss_type': 'focal', 'focal_gamma': 4.355785096570217, 'optimizer_type': 'rmsprop', 'momentum': 0.7370266434658757, 'scheduler_type': 'plateau'}. Best is trial 1 with value: 0.6519980945725803.[0m
  [Trial 002] value=0.0000
[32m[I 2026-08-23 06:51:14,083][0m Trial 3 finished with value: 0.6148915196576616 and parameters: {'dropout': 0.4182884102095674, 'hidden_size': 176, 'num_layers': 3, 'bidirectional': False, 'use_attention': False, 'lr': 9.80493628339332e-05, 'weight_decay': 0.017422719393708316, 'l1_lambda': 2.12322126484776e-07, 'gradient_clip': 3.99293075817933, 'loss_type': 'focal', 'focal_gamma': 4.224662178521262, 'optimizer_type': 'adamw', 'momentum': 0.8521276354841816, 'scheduler_type': 'plateau'}. Best is trial 1 with value: 0.6519980945725803.[0m
  [Trial 003] value=0.6149
[32m[I 2026-08-23 06:51:40,680][0m Trial 4 finished with value: 0.0 and parameters: {'dropout': 0.6160729310450355, 'hidden_size': 141, 'num_layers': 8, 'bidirectional': False, 'use_attention': False, 'lr': 0.011567774847752175, 'weight_decay': 0.023699562752700656, 'l1_lambda': 2.3290721156411818e-07, 'gradient_clip': 2.261707019631482, 'loss_type': 'focal', 'focal_gamma': 4.224509671239693, 'optimizer_type': 'sgd', 'momentum': 0.9270691790315261, 'scheduler_type': 'cosine'}. Best is trial 1 with value: 0.6519980945725803.[0m
  [Trial 004] value=0.0000
[32m[I 2026-08-23 06:52:44,640][0m Trial 5 finished with value: 0.6239109654754519 and parameters: {'dropout': 0.47938754474425715, 'hidden_size': 47, 'num_layers': 6, 'bidirectional': False, 'use_attention': True, 'lr': 0.039671151087858215, 'weight_decay': 3.6990061705424088e-06, 'l1_lambda': 4.8870398181080445e-08, 'gradient_clip': 2.2954227708938784, 'loss_type': 'ce', 'focal_gamma': 3.7134055268709667, 'optimizer_type': 'rmsprop', 'momentum': 0.9692058198812421, 'scheduler_type': 'cosine'}. Best is trial 1 with value: 0.6519980945725803.[0m
  [Trial 005] value=0.6239
[32m[I 2026-08-23 06:53:07,597][0m Trial 6 finished with value: 0.0 and parameters: {'dropout': 0.17921438814127444, 'hidden_size': 60, 'num_layers': 10, 'bidirectional': False, 'use_attention': True, 'lr': 0.0004085150969200003, 'weight_decay': 0.0003085279295683396, 'l1_lambda': 1.90378238819363e-06, 'gradient_clip': 4.899052521345657, 'loss_type': 'focal', 'focal_gamma': 1.7870720425435591, 'optimizer_type': 'rmsprop', 'momentum': 0.9211326177234482, 'scheduler_type': 'plateau'}. Best is trial 1 with value: 0.6519980945725803.[0m
  [Trial 006] value=0.0000
