[32m[I 2026-08-23 08:59:26,434][0m Trial 20 finished with value: 0.5693595506116991 and parameters: {'dropout': 0.3753337855226009, 'hidden_size': 259, 'num_layers': 7, 'use_attention': False, 'lr': 0.000968297783041352, 'weight_decay': 0.00047055434706345055, 'l1_lambda': 0.0006285344013557666, 'gradient_clip': 2.0164472285046844, 'loss_type': 'focal', 'focal_gamma': 2.9759547798523656, 'optimizer_type': 'adamw', 'momentum': 0.8333686910134932, 'scheduler_type': 'cosine'}. Best is trial 0 with value: 0.6505031752161646.[0m
  [Trial 020] value=0.5694
[32m[I 2026-08-23 09:00:34,703][0m Trial 21 finished with value: 0.656449735064662 and parameters: {'dropout': 0.6167479764518774, 'hidden_size': 153, 'num_layers': 6, 'use_attention': False, 'lr': 0.00039358948237882207, 'weight_decay': 6.670743225876671e-05, 'l1_lambda': 2.8319108066139077e-08, 'gradient_clip': 4.207183048193145, 'loss_type': 'focal', 'focal_gamma': 2.030244448806975, 'optimizer_type': 'adamw', 'momentum': 0.8949967826869057, 'scheduler_type': 'cosine'}. Best is trial 21 with value: 0.656449735064662.[0m
  [Trial 021] value=0.6564
[32m[I 2026-08-23 09:01:19,594][0m Trial 22 finished with value: 0.6414585680350456 and parameters: {'dropout': 0.61484074750441, 'hidden_size': 169, 'num_layers': 7, 'use_attention': False, 'lr': 0.00023520637268461357, 'weight_decay': 2.2003792832576336e-06, 'l1_lambda': 1.1510402474562131e-07, 'gradient_clip': 4.09896711093461, 'loss_type': 'focal', 'focal_gamma': 2.3250320161915834, 'optimizer_type': 'adamw', 'momentum': 0.9035223294452187, 'scheduler_type': 'cosine'}. Best is trial 21 with value: 0.656449735064662.[0m
  [Trial 022] value=0.6415
[32m[I 2026-08-23 09:01:41,486][0m Trial 23 finished with value: 0.6355145489539863 and parameters: {'dropout': 0.5302133740000452, 'hidden_size': 84, 'num_layers': 5, 'use_attention': False, 'lr': 0.0009249573400672063, 'weight_decay': 0.00015773875577942728, 'l1_lambda': 1.4026296481993095e-08, 'gradient_clip': 3.4346235980721147, 'loss_type': 'focal', 'focal_gamma': 2.7090804904472563, 'optimizer_type': 'adamw', 'momentum': 0.9589106487304792, 'scheduler_type': 'cosine'}. Best is trial 21 with value: 0.656449735064662.[0m
  [Trial 023] value=0.6355
[32m[I 2026-08-23 09:02:38,393][0m Trial 24 finished with value: 0.6357687156316142 and parameters: {'dropout': 0.6337380063973875, 'hidden_size': 146, 'num_layers': 6, 'use_attention': False, 'lr': 0.00014064841267884284, 'weight_decay': 1.2359296869757592e-07, 'l1_lambda': 1.3721255222737222e-07, 'gradient_clip': 2.9193595510355137, 'loss_type': 'focal', 'focal_gamma': 3.3482963923668096, 'optimizer_type': 'adamw', 'momentum': 0.8887833885179565, 'scheduler_type': 'cosine'}. Best is trial 21 with value: 0.656449735064662.[0m
  [Trial 024] value=0.6358
[32m[I 2026-08-23 09:03:02,616][0m Trial 25 finished with value: 0.0705316363841409 and parameters: {'dropout': 0.5254292327170982, 'hidden_size': 46, 'num_layers': 8, 'use_attention': False, 'lr': 0.0003190317856198706, 'weight_decay': 0.01625192980097697, 'l1_lambda': 7.075920558262385e-07, 'gradient_clip': 4.339084709441299, 'loss_type': 'focal', 'focal_gamma': 2.1340588498193505, 'optimizer_type': 'sgd', 'momentum': 0.8587839181514529, 'scheduler_type': 'cosine'}. Best is trial 21 with value: 0.656449735064662.[0m
  [Trial 025] value=0.0705
[32m[I 2026-08-23 09:03:51,680][0m Trial 26 finished with value: 0.6431536319376905 and parameters: {'dropout': 0.6920797524104197, 'hidden_size': 288, 'num_layers': 7, 'use_attention': True, 'lr': 7.692234299078121e-05, 'weight_decay': 0.0015841060326017653, 'l1_lambda': 1.0226086109989802e-08, 'gradient_clip': 3.756028066307899, 'loss_type': 'ce', 'focal_gamma': 2.715388127959782, 'optimizer_type': 'adamw', 'momentum': 0.9342089667503038, 'scheduler_type': 'cosine'}. Best is trial 21 with value: 0.656449735064662.[0m
  [Trial 026] value=0.6432
[32m[I 2026-08-23 09:04:21,476][0m Trial 27 finished with value: 0.6361223133567172 and parameters: {'dropout': 0.5863103979066275, 'hidden_size': 86, 'num_layers': 4, 'use_attention': False, 'lr': 0.003507968050791127, 'weight_decay': 8.038932755407812e-05, 'l1_lambda': 6.998584215340812e-06, 'gradient_clip': 3.270630381182782, 'loss_type': 'focal', 'focal_gamma': 3.9747730166048965, 'optimizer_type': 'adamw', 'momentum': 0.7734657591189675, 'scheduler_type': 'cosine'}. Best is trial 21 with value: 0.656449735064662.[0m
  [Trial 027] value=0.6361
[32m[I 2026-08-23 09:05:11,562][0m Trial 28 finished with value: 0.6474172798672662 and parameters: {'dropout': 0.4068204628097744, 'hidden_size': 168, 'num_layers': 6, 'use_attention': False, 'lr': 0.0006696946772778589, 'weight_decay': 0.0003357843149866271, 'l1_lambda': 9.692496924475716e-07, 'gradient_clip': 2.643192096761001, 'loss_type': 'focal', 'focal_gamma': 1.9063564537695443, 'optimizer_type': 'adamw', 'momentum': 0.8206389889991647, 'scheduler_type': 'cosine'}. Best is trial 21 with value: 0.656449735064662.[0m
  [Trial 028] value=0.6474
[32m[I 2026-08-23 09:06:10,295][0m Trial 29 finished with value: 0.48551624806289145 and parameters: {'dropout': 0.6268246796716006, 'hidden_size': 69, 'num_layers': 5, 'use_attention': True, 'lr': 0.000292282756014564, 'weight_decay': 0.015048452301183516, 'l1_lambda': 3.08179094725794e-05, 'gradient_clip': 2.4317678339402065, 'loss_type': 'focal', 'focal_gamma': 3.652645327952081, 'optimizer_type': 'sgd', 'momentum': 0.955646654899846, 'scheduler_type': 'cosine'}. Best is trial 21 with value: 0.656449735064662.[0m
  [Trial 029] value=0.4855
[32m[I 2026-08-23 09:10:06,575][0m Trial 0 finished with value: 0.6300810178090863 and parameters: {'dropout': 0.3120198310213603, 'd_model': 64, 'd_state': 57, 'num_layers': 5, 'expand': 2, 'mimo_rank': 2, 'lr': 0.000561377726374295, 'weight_decay': 1.1456561499706768e-05, 'l1_lambda': 2.44211316505051e-07, 'gradient_clip': 4.963862423035407, 'loss_type': 'ce', 'focal_gamma': 3.760487936856346, 'optimizer_type': 'adamw', 'momentum': 0.9018372201751566, 'scheduler_type': 'plateau'}. Best is trial 0 with value: 0.6300810178090863.[0m
  [Trial 000] value=0.6301
[32m[I 2026-08-23 09:11:02,095][0m Trial 1 finished with value: 0.5451422039267141 and parameters: {'dropout': 0.21714585347447918, 'd_model': 64, 'd_state': 18, 'num_layers': 2, 'expand': 2, 'mimo_rank': 1, 'lr': 0.00021339860574117503, 'weight_decay': 1.7656287359767937e-05, 'l1_lambda': 0.004271956668627738, 'gradient_clip': 2.640578620862168, 'loss_type': 'focal', 'focal_gamma': 3.5400883764534883, 'optimizer_type': 'adamw', 'momentum': 0.9521312692525349, 'scheduler_type': 'cosine'}. Best is trial 0 with value: 0.6300810178090863.[0m
  [Trial 001] value=0.5451
[32m[I 2026-08-23 09:13:06,868][0m Trial 2 finished with value: 0.6258233446144656 and parameters: {'dropout': 0.2870003842713345, 'd_model': 128, 'd_state': 52, 'num_layers': 2, 'expand': 4, 'mimo_rank': 1, 'lr': 0.00010835820934538592, 'weight_decay': 0.0015772534541227212, 'l1_lambda': 1.604019985285982e-08, 'gradient_clip': 3.6306821927240596, 'loss_type': 'focal', 'focal_gamma': 1.8119286550142553, 'optimizer_type': 'adamw', 'momentum': 0.968475832716839, 'scheduler_type': 'plateau'}. Best is trial 0 with value: 0.6300810178090863.[0m
  [Trial 002] value=0.6258
[32m[I 2026-08-23 09:40:28,460][0m Trial 3 finished with value: 0.6215973055303406 and parameters: {'dropout': 0.39402961639100426, 'd_model': 256, 'd_state': 13, 'num_layers': 7, 'expand': 4, 'mimo_rank': 8, 'lr': 0.00016699953624242785, 'weight_decay': 0.0007574543427323734, 'l1_lambda': 0.001043950803089373, 'gradient_clip': 2.5674829559239623, 'loss_type': 'ce', 'focal_gamma': 1.21319853187544, 'optimizer_type': 'adamw', 'momentum': 0.9572633809669607, 'scheduler_type': 'cosine'}. Best is trial 0 with value: 0.6300810178090863.[0m
  [Trial 003] value=0.6216
[32m[I 2026-08-23 09:42:46,340][0m Trial 4 finished with value: 0.6255693760009913 and parameters: {'dropout': 0.16823912681823114, 'd_model': 256, 'd_state': 9, 'num_layers': 6, 'expand': 2, 'mimo_rank': 1, 'lr': 5.3457405192368536e-05, 'weight_decay': 0.0017162252340423305, 'l1_lambda': 0.0005578794520621228, 'gradient_clip': 1.1656619802048134, 'loss_type': 'ce', 'focal_gamma': 2.438266248847701, 'optimizer_type': 'adamw', 'momentum': 0.7300876123202967, 'scheduler_type': 'plateau'}. Best is trial 0 with value: 0.6300810178090863.[0m
  [Trial 004] value=0.6256
[32m[I 2026-08-23 09:50:42,787][0m Trial 5 finished with value: 0.5647064790270327 and parameters: {'dropout': 0.09777107783814767, 'd_model': 256, 'd_state': 52, 'num_layers': 5, 'expand': 4, 'mimo_rank': 1, 'lr': 0.0021586599931044353, 'weight_decay': 0.0004674771120580084, 'l1_lambda': 0.00913343202206596, 'gradient_clip': 3.6277185414982243, 'loss_type': 'ce', 'focal_gamma': 3.766712977054065, 'optimizer_type': 'adamw', 'momentum': 0.702240310239691, 'scheduler_type': 'cosine'}. Best is trial 0 with value: 0.6300810178090863.[0m
  [Trial 005] value=0.5647
[32m[I 2026-08-23 09:51:25,734][0m Trial 6 finished with value: 0.6179360276448288 and parameters: {'dropout': 0.34139710100720905, 'd_model': 256, 'd_state': 54, 'num_layers': 1, 'expand': 2, 'mimo_rank': 1, 'lr': 0.00015337878543577756, 'weight_decay': 3.4346107761142314e-05, 'l1_lambda': 2.0687266807546675e-05, 'gradient_clip': 4.379298229086369, 'loss_type': 'focal', 'focal_gamma': 3.89961583248241, 'optimizer_type': 'adamw', 'momentum': 0.8284756755504253, 'scheduler_type': 'cosine'}. Best is trial 0 with value: 0.6300810178090863.[0m
  [Trial 006] value=0.6179
[32m[I 2026-08-23 09:57:37,416][0m Trial 7 finished with value: 0.6280011570393934 and parameters: {'dropout': 0.38469424145997455, 'd_model': 256, 'd_state': 20, 'num_layers': 3, 'expand': 2, 'mimo_rank': 8, 'lr': 0.0009260170318038571, 'weight_decay': 7.3363455969396045e-06, 'l1_lambda': 1.3229081051564311e-05, 'gradient_clip': 2.374914757759342, 'loss_type': 'ce', 'focal_gamma': 2.12857511631118, 'optimizer_type': 'adamw', 'momentum': 0.8943728032103301, 'scheduler_type': 'plateau'}. Best is trial 0 with value: 0.6300810178090863.[0m
  [Trial 007] value=0.6280
[32m[I 2026-08-23 09:58:23,305][0m Trial 8 finished with value: 0.6405789577007038 and parameters: {'dropout': 0.18133099028099237, 'd_model': 128, 'd_state': 9, 'num_layers': 2, 'expand': 2, 'mimo_rank': 2, 'lr': 0.0004377918242998898, 'weight_decay': 3.860702303715272e-05, 'l1_lambda': 1.4823280679456673e-07, 'gradient_clip': 1.615876860375336, 'loss_type': 'ce', 'focal_gamma': 2.05987812263688, 'optimizer_type': 'adamw', 'momentum': 0.7980212398716633, 'scheduler_type': 'plateau'}. Best is trial 8 with value: 0.6405789577007038.[0m
  [Trial 008] value=0.6406
[32m[I 2026-08-23 10:04:26,440][0m Trial 9 finished with value: 0.6353044597400466 and parameters: {'dropout': 0.22876571431062848, 'd_model': 32, 'd_state': 42, 'num_layers': 3, 'expand': 2, 'mimo_rank': 4, 'lr': 0.00015451598371103964, 'weight_decay': 4.249238340906029e-07, 'l1_lambda': 3.2748162705987426e-07, 'gradient_clip': 2.699892861662116, 'loss_type': 'focal', 'focal_gamma': 1.6154393423519413, 'optimizer_type': 'adamw', 'momentum': 0.9884823827614724, 'scheduler_type': 'plateau'}. Best is trial 8 with value: 0.6405789577007038.[0m
  [Trial 009] value=0.6353
[32m[I 2026-08-23 10:06:59,349][0m Trial 10 finished with value: 0.6305534635430872 and parameters: {'dropout': 0.06234626019055303, 'd_model': 128, 'd_state': 8, 'num_layers': 8, 'expand': 4, 'mimo_rank': 2, 'lr': 0.0013432240795317372, 'weight_decay': 1.4748094390475835e-07, 'l1_lambda': 5.452909206436596e-07, 'gradient_clip': 0.6079288753922609, 'loss_type': 'ce', 'focal_gamma': 4.926546068618384, 'optimizer_type': 'adamw', 'momentum': 0.7904126042635484, 'scheduler_type': 'plateau'}. Best is trial 8 with value: 0.6405789577007038.[0m
  [Trial 010] value=0.6306
[32m[I 2026-08-23 10:10:44,368][0m Trial 11 finished with value: 0.6303555820097234 and parameters: {'dropout': 0.19220316338401772, 'd_model': 32, 'd_state': 35, 'num_layers': 3, 'expand': 2, 'mimo_rank': 4, 'lr': 0.0003996910324695706, 'weight_decay': 5.796075642220726e-07, 'l1_lambda': 2.992006585650264e-07, 'gradient_clip': 1.5423172754420114, 'loss_type': 'focal', 'focal_gamma': 1.119278108480529, 'optimizer_type': 'adamw', 'momentum': 0.8015053716002334, 'scheduler_type': 'plateau'}. Best is trial 8 with value: 0.6405789577007038.[0m
  [Trial 011] value=0.6304
[32m[I 2026-08-23 10:14:43,851][0m Trial 12 finished with value: 0.6232574719459134 and parameters: {'dropout': 0.13964301573003501, 'd_model': 32, 'd_state': 31, 'num_layers': 3, 'expand': 2, 'mimo_rank': 4, 'lr': 0.00029561792860152404, 'weight_decay': 0.08003548983192213, 'l1_lambda': 1.1793728066249928e-08, 'gradient_clip': 1.8714899272321655, 'loss_type': 'focal', 'focal_gamma': 2.8389222991751306, 'optimizer_type': 'adamw', 'momentum': 0.8860728569280676, 'scheduler_type': 'plateau'}. Best is trial 8 with value: 0.6405789577007038.[0m
  [Trial 012] value=0.6233
[32m[I 2026-08-23 10:15:36,975][0m Trial 13 finished with value: 0.6333977776965418 and parameters: {'dropout': 0.2752102198326541, 'd_model': 128, 'd_state': 31, 'num_layers': 1, 'expand': 2, 'mimo_rank': 2, 'lr': 8.009154957859337e-05, 'weight_decay': 1.3410241432326232e-06, 'l1_lambda': 2.0948261047547187e-06, 'gradient_clip': 3.258414147711794, 'loss_type': 'focal', 'focal_gamma': 1.7755986815866611, 'optimizer_type': 'adamw', 'momentum': 0.762714286757747, 'scheduler_type': 'plateau'}. Best is trial 8 with value: 0.6405789577007038.[0m
  [Trial 013] value=0.6334
[32m[I 2026-08-23 10:18:30,959][0m Trial 14 finished with value: 0.6352426384278239 and parameters: {'dropout': 0.2447441517469481, 'd_model': 32, 'd_state': 13, 'num_layers': 4, 'expand': 2, 'mimo_rank': 4, 'lr': 0.0005862592945427754, 'weight_decay': 1.5006849601576641e-06, 'l1_lambda': 7.534957433801895e-08, 'gradient_clip': 1.8657404931590995, 'loss_type': 'ce', 'focal_gamma': 1.6241917551272986, 'optimizer_type': 'adamw', 'momentum': 0.8511601805714171, 'scheduler_type': 'plateau'}. Best is trial 8 with value: 0.6405789577007038.[0m
  [Trial 014] value=0.6352
[32m[I 2026-08-23 10:22:02,501][0m Trial 15 finished with value: 0.6186818945993893 and parameters: {'dropout': 0.12909570336619303, 'd_model': 32, 'd_state': 37, 'num_layers': 4, 'expand': 2, 'mimo_rank': 4, 'lr': 0.00027271394151721315, 'weight_decay': 1.0793171875117166e-07, 'l1_lambda': 2.4277184622670876e-06, 'gradient_clip': 0.8709820593484126, 'loss_type': 'focal', 'focal_gamma': 2.5265314807232757, 'optimizer_type': 'adamw', 'momentum': 0.8540354825900702, 'scheduler_type': 'plateau'}. Best is trial 8 with value: 0.6405789577007038.[0m
  [Trial 015] value=0.6187
[32m[I 2026-08-23 10:23:36,861][0m Trial 16 finished with value: 0.6358575807971979 and parameters: {'dropout': 0.2338554264573317, 'd_model': 128, 'd_state': 14, 'num_layers': 2, 'expand': 2, 'mimo_rank': 2, 'lr': 0.0004387045756118133, 'weight_decay': 0.00013994027717671793, 'l1_lambda': 8.030243073461587e-05, 'gradient_clip': 3.1465471494056767, 'loss_type': 'focal', 'focal_gamma': 3.134761402211225, 'optimizer_type': 'adamw', 'momentum': 0.9278198109911048, 'scheduler_type': 'plateau'}. Best is trial 8 with value: 0.6405789577007038.[0m
  [Trial 016] value=0.6359
[32m[I 2026-08-23 10:24:42,054][0m Trial 17 finished with value: 0.6354523053001783 and parameters: {'dropout': 0.17659575663708163, 'd_model': 128, 'd_state': 11, 'num_layers': 2, 'expand': 2, 'mimo_rank': 2, 'lr': 0.0008711714078422819, 'weight_decay': 0.00013053403310748729, 'l1_lambda': 0.0001223796349348128, 'gradient_clip': 3.2019028811887322, 'loss_type': 'ce', 'focal_gamma': 3.2896279813753644, 'optimizer_type': 'adamw', 'momentum': 0.926411367064452, 'scheduler_type': 'plateau'}. Best is trial 8 with value: 0.6405789577007038.[0m
  [Trial 017] value=0.6355
[32m[I 2026-08-23 10:25:43,107][0m Trial 18 finished with value: 0.6397630524601985 and parameters: {'dropout': 0.25479705252676205, 'd_model': 128, 'd_state': 16, 'num_layers': 1, 'expand': 4, 'mimo_rank': 2, 'lr': 0.0005010483738325728, 'weight_decay': 0.00789598437456163, 'l1_lambda': 6.519704378218195e-05, 'gradient_clip': 1.948498071875699, 'loss_type': 'ce', 'focal_gamma': 4.402475777031232, 'optimizer_type': 'adamw', 'momentum': 0.7665786805372442, 'scheduler_type': 'cosine'}. Best is trial 8 with value: 0.6405789577007038.[0m
  [Trial 018] value=0.6398
[32m[I 2026-08-23 10:26:18,930][0m Trial 19 finished with value: 0.6219044308936291 and parameters: {'dropout': 0.3368586131408396, 'd_model': 128, 'd_state': 24, 'num_layers': 1, 'expand': 4, 'mimo_rank': 2, 'lr': 0.001706522169741573, 'weight_decay': 0.014420642147355328, 'l1_lambda': 3.4135022088616383e-06, 'gradient_clip': 2.009058935650699, 'loss_type': 'ce', 'focal_gamma': 4.48936350987714, 'optimizer_type': 'adamw', 'momentum': 0.7483399574986367, 'scheduler_type': 'cosine'}. Best is trial 8 with value: 0.6405789577007038.[0m
  [Trial 019] value=0.6219
[32m[I 2026-08-23 10:27:16,537][0m Trial 20 finished with value: 0.6519896422680298 and parameters: {'dropout': 0.2765495421632738, 'd_model': 128, 'd_state': 16, 'num_layers': 1, 'expand': 4, 'mimo_rank': 2, 'lr': 0.0029097097420627753, 'weight_decay': 0.019062156155175744, 'l1_lambda': 5.355978108325116e-05, 'gradient_clip': 1.3116476129408636, 'loss_type': 'ce', 'focal_gamma': 4.41111955098225, 'optimizer_type': 'adamw', 'momentum': 0.7890096390425041, 'scheduler_type': 'cosine'}. Best is trial 20 with value: 0.6519896422680298.[0m
  [Trial 020] value=0.6520
[32m[I 2026-08-23 10:27:55,123][0m Trial 21 finished with value: 0.6339067084237094 and parameters: {'dropout': 0.2682979227344362, 'd_model': 128, 'd_state': 16, 'num_layers': 1, 'expand': 4, 'mimo_rank': 2, 'lr': 0.0009728419702997007, 'weight_decay': 0.00938188082822208, 'l1_lambda': 5.9654926176246545e-05, 'gradient_clip': 1.3929334272870892, 'loss_type': 'ce', 'focal_gamma': 4.405233593416993, 'optimizer_type': 'adamw', 'momentum': 0.7903243949408699, 'scheduler_type': 'cosine'}. Best is trial 20 with value: 0.6519896422680298.[0m
  [Trial 021] value=0.6339
[32m[I 2026-08-23 10:29:23,122][0m Trial 22 finished with value: 0.6387651175825405 and parameters: {'dropout': 0.29918363888512967, 'd_model': 128, 'd_state': 24, 'num_layers': 1, 'expand': 4, 'mimo_rank': 2, 'lr': 0.0013407117106346903, 'weight_decay': 0.09125488727650881, 'l1_lambda': 0.0003208361208305659, 'gradient_clip': 1.2602976357237368, 'loss_type': 'ce', 'focal_gamma': 4.266045463966343, 'optimizer_type': 'adamw', 'momentum': 0.8199147124432322, 'scheduler_type': 'cosine'}. Best is trial 20 with value: 0.6519896422680298.[0m
  [Trial 022] value=0.6388
[32m[I 2026-08-23 10:30:43,030][0m Trial 23 finished with value: 0.6230110170831223 and parameters: {'dropout': 0.20841990481114836, 'd_model': 128, 'd_state': 11, 'num_layers': 2, 'expand': 4, 'mimo_rank': 2, 'lr': 0.002818651993046902, 'weight_decay': 0.006859836380999704, 'l1_lambda': 2.6113822771872367e-05, 'gradient_clip': 1.9938237155775247, 'loss_type': 'ce', 'focal_gamma': 4.868893143691389, 'optimizer_type': 'adamw', 'momentum': 0.7570339293889157, 'scheduler_type': 'cosine'}. Best is trial 20 with value: 0.6519896422680298.[0m
  [Trial 023] value=0.6230
[32m[I 2026-08-23 10:31:14,844][0m Trial 24 finished with value: 0.6265791380813013 and parameters: {'dropout': 0.2605170585537007, 'd_model': 128, 'd_state': 10, 'num_layers': 1, 'expand': 4, 'mimo_rank': 2, 'lr': 0.0006228104535200633, 'weight_decay': 0.020559656965925016, 'l1_lambda': 5.9843854180835065e-06, 'gradient_clip': 0.8684111983265949, 'loss_type': 'ce', 'focal_gamma': 4.15188696607454, 'optimizer_type': 'adamw', 'momentum': 0.7750151209191155, 'scheduler_type': 'cosine'}. Best is trial 20 with value: 0.6519896422680298.[0m
  [Trial 024] value=0.6266
[32m[I 2026-08-23 10:34:54,096][0m Trial 25 finished with value: 0.6403887320484786 and parameters: {'dropout': 0.1477761779769438, 'd_model': 64, 'd_state': 16, 'num_layers': 2, 'expand': 4, 'mimo_rank': 8, 'lr': 0.0028829636031503982, 'weight_decay': 0.002167137270772244, 'l1_lambda': 0.00021350496908403626, 'gradient_clip': 1.592159927890615, 'loss_type': 'ce', 'focal_gamma': 4.669621408710507, 'optimizer_type': 'adamw', 'momentum': 0.718403586595787, 'scheduler_type': 'cosine'}. Best is trial 20 with value: 0.6519896422680298.[0m
  [Trial 025] value=0.6404
[32m[I 2026-08-23 10:38:34,518][0m Trial 26 finished with value: 0.637179416000499 and parameters: {'dropout': 0.15081843331908373, 'd_model': 64, 'd_state': 8, 'num_layers': 4, 'expand': 4, 'mimo_rank': 8, 'lr': 0.002977663019075712, 'weight_decay': 0.002895752828482099, 'l1_lambda': 0.00020545410632164825, 'gradient_clip': 0.5582238394662542, 'loss_type': 'ce', 'focal_gamma': 2.8108349295726245, 'optimizer_type': 'adamw', 'momentum': 0.7106576729492515, 'scheduler_type': 'cosine'}. Best is trial 20 with value: 0.6519896422680298.[0m
  [Trial 026] value=0.6372
[32m[I 2026-08-23 10:41:49,170][0m Trial 27 finished with value: 0.6211997486066663 and parameters: {'dropout': 0.10933697226708852, 'd_model': 64, 'd_state': 21, 'num_layers': 2, 'expand': 4, 'mimo_rank': 8, 'lr': 0.0018687209239758057, 'weight_decay': 0.00043937620172729795, 'l1_lambda': 0.001119318641823212, 'gradient_clip': 1.6245514489189583, 'loss_type': 'ce', 'focal_gamma': 4.641622072637567, 'optimizer_type': 'adamw', 'momentum': 0.8201746256315029, 'scheduler_type': 'cosine'}. Best is trial 20 with value: 0.6519896422680298.[0m
  [Trial 027] value=0.6212
