[32m[I 2026-08-23 08:18:18,850][0m Trial 10 finished with value: 0.634273257385803 and parameters: {'dropout': 0.1419736034745979, 'd_model': 128, 'n_heads': 8, 'num_layers': 8, 'lr': 0.0017949840225688508, 'weight_decay': 1.298830729880183e-07, 'l1_lambda': 1.1737529142451853e-08, 'gradient_clip': 4.958478505232338, 'loss_type': 'ce', 'focal_gamma': 4.912514284661504, 'optimizer_type': 'adamw', 'momentum': 0.8508937014407212, 'scheduler_type': 'cosine'}. Best is trial 9 with value: 0.6448752629734973.[0m
  [Trial 010] value=0.6343
[32m[I 2026-08-23 08:19:14,757][0m Trial 11 finished with value: 0.6335672375152941 and parameters: {'dropout': 0.11783849179535233, 'd_model': 128, 'n_heads': 8, 'num_layers': 4, 'lr': 5.108118746980752e-05, 'weight_decay': 1.2747944561585085e-06, 'l1_lambda': 0.0003423535219597047, 'gradient_clip': 4.808105810568698, 'loss_type': 'focal', 'focal_gamma': 3.02696800830087, 'optimizer_type': 'adamw', 'momentum': 0.7371814472174524, 'scheduler_type': 'cosine'}. Best is trial 9 with value: 0.6448752629734973.[0m
  [Trial 011] value=0.6336
[32m[I 2026-08-23 08:19:54,955][0m Trial 12 finished with value: 0.6039828274169967 and parameters: {'dropout': 0.10617619149636037, 'd_model': 128, 'n_heads': 4, 'num_layers': 3, 'lr': 9.48608202354317e-05, 'weight_decay': 5.767793523188164e-06, 'l1_lambda': 0.0012349853833750046, 'gradient_clip': 3.875773450550103, 'loss_type': 'focal', 'focal_gamma': 3.578926488379306, 'optimizer_type': 'adamw', 'momentum': 0.781984383498955, 'scheduler_type': 'cosine'}. Best is trial 9 with value: 0.6448752629734973.[0m
  [Trial 012] value=0.6040
[32m[I 2026-08-23 08:20:49,108][0m Trial 13 finished with value: 0.6350570834077234 and parameters: {'dropout': 0.13153096880094012, 'd_model': 128, 'n_heads': 8, 'num_layers': 6, 'lr': 0.00033796309423108354, 'weight_decay': 6.286205385534992e-07, 'l1_lambda': 5.044252965242897e-07, 'gradient_clip': 3.249103019374316, 'loss_type': 'focal', 'focal_gamma': 2.6237836111776174, 'optimizer_type': 'adamw', 'momentum': 0.7778247477096693, 'scheduler_type': 'cosine'}. Best is trial 9 with value: 0.6448752629734973.[0m
  [Trial 013] value=0.6351
[32m[I 2026-08-23 08:21:48,003][0m Trial 14 finished with value: 0.6162320040414465 and parameters: {'dropout': 0.16456598250701301, 'd_model': 64, 'n_heads': 8, 'num_layers': 1, 'lr': 9.785928479306128e-05, 'weight_decay': 1.1303286405665955e-05, 'l1_lambda': 0.0001763321342099589, 'gradient_clip': 4.5107227399905065, 'loss_type': 'ce', 'focal_gamma': 3.74206189548476, 'optimizer_type': 'adamw', 'momentum': 0.8579606385971958, 'scheduler_type': 'cosine'}. Best is trial 9 with value: 0.6448752629734973.[0m
  [Trial 014] value=0.6162
[32m[I 2026-08-23 08:22:47,298][0m Trial 15 finished with value: 0.6311651465331388 and parameters: {'dropout': 0.2489324760657995, 'd_model': 32, 'n_heads': 8, 'num_layers': 3, 'lr': 0.001111541601188152, 'weight_decay': 1.7630711791503562e-06, 'l1_lambda': 4.961710295629348e-05, 'gradient_clip': 3.7520676531417205, 'loss_type': 'focal', 'focal_gamma': 1.2205494990203296, 'optimizer_type': 'adamw', 'momentum': 0.7697495884436367, 'scheduler_type': 'cosine'}. Best is trial 9 with value: 0.6448752629734973.[0m
  [Trial 015] value=0.6312
[32m[I 2026-08-23 08:23:51,471][0m Trial 16 finished with value: 0.6326712335066824 and parameters: {'dropout': 0.08398519061956881, 'd_model': 256, 'n_heads': 4, 'num_layers': 6, 'lr': 0.00011011772711636118, 'weight_decay': 1.0420852462768003e-07, 'l1_lambda': 2.5868708608935145e-07, 'gradient_clip': 4.430964946573971, 'loss_type': 'focal', 'focal_gamma': 2.6515421616869923, 'optimizer_type': 'adamw', 'momentum': 0.703341149357825, 'scheduler_type': 'cosine'}. Best is trial 9 with value: 0.6448752629734973.[0m
  [Trial 016] value=0.6327
[32m[I 2026-08-23 08:24:22,969][0m Trial 17 finished with value: 0.6050336718062624 and parameters: {'dropout': 0.08469609148549945, 'd_model': 128, 'n_heads': 8, 'num_layers': 3, 'lr': 0.00028224852934771944, 'weight_decay': 2.871312190803455e-05, 'l1_lambda': 0.007538756724020989, 'gradient_clip': 3.346509724865549, 'loss_type': 'focal', 'focal_gamma': 3.3809412732179913, 'optimizer_type': 'adamw', 'momentum': 0.8149117181304816, 'scheduler_type': 'cosine'}. Best is trial 9 with value: 0.6448752629734973.[0m
  [Trial 017] value=0.6050
[32m[I 2026-08-23 08:25:43,960][0m Trial 18 finished with value: 0.645137351910466 and parameters: {'dropout': 0.14158032873937276, 'd_model': 128, 'n_heads': 8, 'num_layers': 4, 'lr': 0.0005190808891755867, 'weight_decay': 4.363755508919146e-06, 'l1_lambda': 0.0007509915763960318, 'gradient_clip': 2.5293767183183284, 'loss_type': 'ce', 'focal_gamma': 4.338413871919096, 'optimizer_type': 'adamw', 'momentum': 0.753519379706233, 'scheduler_type': 'cosine'}. Best is trial 18 with value: 0.645137351910466.[0m
  [Trial 018] value=0.6451
[32m[I 2026-08-23 08:26:38,919][0m Trial 19 finished with value: 0.6564127163794263 and parameters: {'dropout': 0.23407702020824855, 'd_model': 128, 'n_heads': 8, 'num_layers': 6, 'lr': 0.0005299439759294297, 'weight_decay': 0.0024369864080181197, 'l1_lambda': 1.057375144412032e-06, 'gradient_clip': 1.8419417004631713, 'loss_type': 'ce', 'focal_gamma': 4.8467407132197655, 'optimizer_type': 'adamw', 'momentum': 0.743215195812082, 'scheduler_type': 'cosine'}. Best is trial 19 with value: 0.6564127163794263.[0m
  [Trial 019] value=0.6564
[32m[I 2026-08-23 08:28:12,058][0m Trial 20 finished with value: 0.6493753537702076 and parameters: {'dropout': 0.24184939809987088, 'd_model': 32, 'n_heads': 4, 'num_layers': 6, 'lr': 0.0005438289070446155, 'weight_decay': 0.0028364678608658834, 'l1_lambda': 3.904590471925884e-08, 'gradient_clip': 1.7961351144613045, 'loss_type': 'ce', 'focal_gamma': 4.9413552275912735, 'optimizer_type': 'adamw', 'momentum': 0.7364146032496374, 'scheduler_type': 'cosine'}. Best is trial 19 with value: 0.6564127163794263.[0m
  [Trial 020] value=0.6494
[32m[I 2026-08-23 08:29:20,363][0m Trial 21 finished with value: 0.6496614783490613 and parameters: {'dropout': 0.24363122674893134, 'd_model': 32, 'n_heads': 4, 'num_layers': 6, 'lr': 0.0005676730003308047, 'weight_decay': 0.0017923913366162342, 'l1_lambda': 3.285424693120019e-08, 'gradient_clip': 1.8483284871511751, 'loss_type': 'ce', 'focal_gamma': 4.977317579490375, 'optimizer_type': 'adamw', 'momentum': 0.7361847231260656, 'scheduler_type': 'cosine'}. Best is trial 19 with value: 0.6564127163794263.[0m
  [Trial 021] value=0.6497
[32m[I 2026-08-23 08:30:20,790][0m Trial 22 finished with value: 0.6406646836113911 and parameters: {'dropout': 0.24462749069060633, 'd_model': 32, 'n_heads': 4, 'num_layers': 6, 'lr': 0.0009793587786354181, 'weight_decay': 0.0026802657623316924, 'l1_lambda': 1.3631467072839068e-08, 'gradient_clip': 1.774373445095001, 'loss_type': 'ce', 'focal_gamma': 4.959545747981252, 'optimizer_type': 'adamw', 'momentum': 0.7112484086782653, 'scheduler_type': 'cosine'}. Best is trial 19 with value: 0.6564127163794263.[0m
  [Trial 022] value=0.6407
[32m[I 2026-08-23 08:31:31,217][0m Trial 23 finished with value: 0.6383969014781662 and parameters: {'dropout': 0.2845709761303823, 'd_model': 32, 'n_heads': 4, 'num_layers': 8, 'lr': 0.0010700303414867365, 'weight_decay': 0.0018598930701245985, 'l1_lambda': 5.4051563366981355e-08, 'gradient_clip': 1.7818569100415778, 'loss_type': 'ce', 'focal_gamma': 4.452934595297117, 'optimizer_type': 'adamw', 'momentum': 0.811300502104466, 'scheduler_type': 'cosine'}. Best is trial 19 with value: 0.6564127163794263.[0m
  [Trial 023] value=0.6384
[32m[I 2026-08-23 08:33:11,453][0m Trial 24 finished with value: 0.6421005884663223 and parameters: {'dropout': 0.2528935074741127, 'd_model': 32, 'n_heads': 4, 'num_layers': 7, 'lr': 0.00044154449457834815, 'weight_decay': 0.09968536280602112, 'l1_lambda': 5.785011854643876e-08, 'gradient_clip': 1.7351913359772309, 'loss_type': 'ce', 'focal_gamma': 4.398365836170786, 'optimizer_type': 'adamw', 'momentum': 0.7409813968074115, 'scheduler_type': 'cosine'}. Best is trial 19 with value: 0.6564127163794263.[0m
  [Trial 024] value=0.6421
[32m[I 2026-08-23 08:34:52,190][0m Trial 25 finished with value: 0.6490845342097218 and parameters: {'dropout': 0.22949748872680165, 'd_model': 32, 'n_heads': 4, 'num_layers': 6, 'lr': 0.0007260097722671925, 'weight_decay': 0.010400977637544434, 'l1_lambda': 1.1008301158119041e-06, 'gradient_clip': 0.7935320037860787, 'loss_type': 'ce', 'focal_gamma': 4.640969368618084, 'optimizer_type': 'adamw', 'momentum': 0.879250703959958, 'scheduler_type': 'cosine'}. Best is trial 19 with value: 0.6564127163794263.[0m
  [Trial 025] value=0.6491
[32m[I 2026-08-23 08:35:55,035][0m Trial 26 finished with value: 0.6501681207894554 and parameters: {'dropout': 0.2713898732886233, 'd_model': 32, 'n_heads': 4, 'num_layers': 7, 'lr': 0.001604403751258613, 'weight_decay': 0.0015703619935245015, 'l1_lambda': 4.5303955834044176e-08, 'gradient_clip': 2.0602506276229793, 'loss_type': 'ce', 'focal_gamma': 4.022034171687249, 'optimizer_type': 'adamw', 'momentum': 0.7220108603171198, 'scheduler_type': 'cosine'}. Best is trial 19 with value: 0.6564127163794263.[0m
  [Trial 026] value=0.6502
[32m[I 2026-08-23 08:37:07,226][0m Trial 27 finished with value: 0.6472235555518181 and parameters: {'dropout': 0.26821419650862, 'd_model': 32, 'n_heads': 4, 'num_layers': 7, 'lr': 0.0016691781206217252, 'weight_decay': 0.001163114470446563, 'l1_lambda': 6.824464672193824e-07, 'gradient_clip': 2.135492805898109, 'loss_type': 'ce', 'focal_gamma': 4.052786911545604, 'optimizer_type': 'adamw', 'momentum': 0.798012140585024, 'scheduler_type': 'cosine'}. Best is trial 19 with value: 0.6564127163794263.[0m
  [Trial 027] value=0.6472
[32m[I 2026-08-23 08:38:21,130][0m Trial 28 finished with value: 0.6406395063781622 and parameters: {'dropout': 0.26801065909644134, 'd_model': 64, 'n_heads': 4, 'num_layers': 8, 'lr': 0.0015070805367591652, 'weight_decay': 0.008651767484227427, 'l1_lambda': 1.1549153053821772e-07, 'gradient_clip': 2.7694711968325545, 'loss_type': 'ce', 'focal_gamma': 4.668163548130714, 'optimizer_type': 'adamw', 'momentum': 0.7015544131147252, 'scheduler_type': 'cosine'}. Best is trial 19 with value: 0.6564127163794263.[0m
  [Trial 028] value=0.6406
[32m[I 2026-08-23 08:39:10,790][0m Trial 29 finished with value: 0.6305590929974124 and parameters: {'dropout': 0.2995261802417268, 'd_model': 256, 'n_heads': 4, 'num_layers': 7, 'lr': 0.002477586357787084, 'weight_decay': 0.022144724189572685, 'l1_lambda': 3.114286480162451e-08, 'gradient_clip': 1.4124492302690435, 'loss_type': 'ce', 'focal_gamma': 4.072593361680857, 'optimizer_type': 'adamw', 'momentum': 0.7486352724866653, 'scheduler_type': 'cosine'}. Best is trial 19 with value: 0.6564127163794263.[0m
  [Trial 029] value=0.6306
[32m[I 2026-08-23 08:41:57,531][0m Trial 0 finished with value: 0.6505031752161646 and parameters: {'dropout': 0.6563178645070186, 'hidden_size': 56, 'num_layers': 8, 'use_attention': False, 'lr': 0.0002300908513859037, 'weight_decay': 0.022710786979559708, 'l1_lambda': 1.0456491054953445e-05, 'gradient_clip': 3.7498737352071347, 'loss_type': 'focal', 'focal_gamma': 2.9571225424409984, 'optimizer_type': 'adamw', 'momentum': 0.9358434548235841, 'scheduler_type': 'cosine'}. Best is trial 0 with value: 0.6505031752161646.[0m
  [Trial 000] value=0.6505
[32m[I 2026-08-23 08:42:19,904][0m Trial 1 finished with value: 0.0 and parameters: {'dropout': 0.4527698043317047, 'hidden_size': 60, 'num_layers': 5, 'use_attention': True, 'lr': 0.007812577402925071, 'weight_decay': 0.00642199998323946, 'l1_lambda': 2.6370310607093375e-06, 'gradient_clip': 2.5825510496655095, 'loss_type': 'focal', 'focal_gamma': 3.527735476041298, 'optimizer_type': 'rmsprop', 'momentum': 0.9611061439923625, 'scheduler_type': 'plateau'}. Best is trial 0 with value: 0.6505031752161646.[0m
  [Trial 001] value=0.0000
[32m[I 2026-08-23 08:46:07,967][0m Trial 2 finished with value: 0.5083348658187118 and parameters: {'dropout': 0.20231579082712037, 'hidden_size': 946, 'num_layers': 3, 'use_attention': True, 'lr': 0.00010607595663119398, 'weight_decay': 8.541286342863047e-05, 'l1_lambda': 1.623247706701982e-05, 'gradient_clip': 1.0178261011071337, 'loss_type': 'ce', 'focal_gamma': 2.3863888708937266, 'optimizer_type': 'sgd', 'momentum': 0.7174517207720364, 'scheduler_type': 'plateau'}. Best is trial 0 with value: 0.6505031752161646.[0m
  [Trial 002] value=0.5083
[32m[I 2026-08-23 08:46:37,474][0m Trial 3 finished with value: 0.5320704293470214 and parameters: {'dropout': 0.24474143290723832, 'hidden_size': 59, 'num_layers': 3, 'use_attention': False, 'lr': 0.00010373943236514688, 'weight_decay': 0.0827254855771445, 'l1_lambda': 4.5541871680233416e-05, 'gradient_clip': 1.2033652743518188, 'loss_type': 'focal', 'focal_gamma': 4.576920259972187, 'optimizer_type': 'rmsprop', 'momentum': 0.7881367327656691, 'scheduler_type': 'cosine'}. Best is trial 0 with value: 0.6505031752161646.[0m
  [Trial 003] value=0.5321
[32m[I 2026-08-23 08:47:17,547][0m Trial 4 finished with value: 0.0 and parameters: {'dropout': 0.2362579489634748, 'hidden_size': 352, 'num_layers': 6, 'use_attention': False, 'lr': 0.023097840448131117, 'weight_decay': 6.626199691727126e-07, 'l1_lambda': 0.00012701849024407657, 'gradient_clip': 4.221605172973473, 'loss_type': 'ce', 'focal_gamma': 3.566375383770671, 'optimizer_type': 'rmsprop', 'momentum': 0.8534156102754492, 'scheduler_type': 'cosine'}. Best is trial 0 with value: 0.6505031752161646.[0m
  [Trial 004] value=0.0000
[32m[I 2026-08-23 08:48:16,467][0m Trial 5 finished with value: 0.6413293751544906 and parameters: {'dropout': 0.4704975419511735, 'hidden_size': 223, 'num_layers': 8, 'use_attention': True, 'lr': 0.0001819433518437493, 'weight_decay': 8.211571962403446e-07, 'l1_lambda': 4.9114920427125146e-08, 'gradient_clip': 1.2317687081483026, 'loss_type': 'focal', 'focal_gamma': 3.952950560123822, 'optimizer_type': 'rmsprop', 'momentum': 0.7430723363632695, 'scheduler_type': 'cosine'}. Best is trial 0 with value: 0.6505031752161646.[0m
  [Trial 005] value=0.6413
[32m[I 2026-08-23 08:49:34,448][0m Trial 6 finished with value: 0.5966861153882118 and parameters: {'dropout': 0.5723420677502555, 'hidden_size': 642, 'num_layers': 4, 'use_attention': True, 'lr': 0.0004381533330265518, 'weight_decay': 0.0001567688146214385, 'l1_lambda': 1.3966293714915816e-05, 'gradient_clip': 0.7895848663271698, 'loss_type': 'ce', 'focal_gamma': 2.030356956064991, 'optimizer_type': 'rmsprop', 'momentum': 0.8033578229478047, 'scheduler_type': 'cosine'}. Best is trial 0 with value: 0.6505031752161646.[0m
  [Trial 006] value=0.5967
[32m[I 2026-08-23 08:51:22,194][0m Trial 7 finished with value: 0.29494816790245104 and parameters: {'dropout': 0.4634263267694809, 'hidden_size': 635, 'num_layers': 7, 'use_attention': True, 'lr': 0.000983165248976867, 'weight_decay': 0.0052308683624082185, 'l1_lambda': 0.0002580705922802699, 'gradient_clip': 2.111206511292922, 'loss_type': 'ce', 'focal_gamma': 4.792643499768195, 'optimizer_type': 'sgd', 'momentum': 0.9089250399625604, 'scheduler_type': 'cosine'}. Best is trial 0 with value: 0.6505031752161646.[0m
  [Trial 007] value=0.2949
[32m[I 2026-08-23 08:51:40,601][0m Trial 8 finished with value: 0.6079826495535744 and parameters: {'dropout': 0.3228537809470253, 'hidden_size': 78, 'num_layers': 2, 'use_attention': False, 'lr': 0.0043419423177765626, 'weight_decay': 0.003153604071955944, 'l1_lambda': 8.580846204925338e-05, 'gradient_clip': 1.9962008268281326, 'loss_type': 'focal', 'focal_gamma': 2.392271416131773, 'optimizer_type': 'rmsprop', 'momentum': 0.9158421972112135, 'scheduler_type': 'plateau'}. Best is trial 0 with value: 0.6505031752161646.[0m
  [Trial 008] value=0.6080
[32m[I 2026-08-23 08:52:24,473][0m Trial 9 finished with value: 0.0 and parameters: {'dropout': 0.6690941118849754, 'hidden_size': 479, 'num_layers': 8, 'use_attention': False, 'lr': 0.03823775823805976, 'weight_decay': 0.0009516469464764596, 'l1_lambda': 0.006271314638824338, 'gradient_clip': 3.814826972593802, 'loss_type': 'focal', 'focal_gamma': 3.2211797422546122, 'optimizer_type': 'adamw', 'momentum': 0.8341256534829851, 'scheduler_type': 'cosine'}. Best is trial 0 with value: 0.6505031752161646.[0m
  [Trial 009] value=0.0000
[32m[I 2026-08-23 08:52:56,538][0m Trial 10 finished with value: 0.6425502731315688 and parameters: {'dropout': 0.061282734569967134, 'hidden_size': 116, 'num_layers': 6, 'use_attention': False, 'lr': 0.0005656969629985399, 'weight_decay': 0.06661816655862966, 'l1_lambda': 3.7873693062584903e-07, 'gradient_clip': 4.772742260413544, 'loss_type': 'focal', 'focal_gamma': 1.1267998070523095, 'optimizer_type': 'adamw', 'momentum': 0.9849356233482154, 'scheduler_type': 'plateau'}. Best is trial 0 with value: 0.6505031752161646.[0m
  [Trial 010] value=0.6426
[32m[I 2026-08-23 08:53:21,686][0m Trial 11 finished with value: 0.6377163030268831 and parameters: {'dropout': 0.056104657841317476, 'hidden_size': 32, 'num_layers': 6, 'use_attention': False, 'lr': 0.0005381151336649681, 'weight_decay': 0.0780081251607925, 'l1_lambda': 4.259719934794557e-07, 'gradient_clip': 4.843727579908825, 'loss_type': 'focal', 'focal_gamma': 1.1645773718147807, 'optimizer_type': 'adamw', 'momentum': 0.9870978504320445, 'scheduler_type': 'plateau'}. Best is trial 0 with value: 0.6505031752161646.[0m
  [Trial 011] value=0.6377
[32m[I 2026-08-23 08:53:57,827][0m Trial 12 finished with value: 0.6390362795948966 and parameters: {'dropout': 0.05391663444733025, 'hidden_size': 118, 'num_layers': 7, 'use_attention': False, 'lr': 0.0016415525108854961, 'weight_decay': 0.07955512090770132, 'l1_lambda': 5.110215102029244e-07, 'gradient_clip': 3.5410446879919313, 'loss_type': 'focal', 'focal_gamma': 1.10635404427173, 'optimizer_type': 'adamw', 'momentum': 0.9294951223724295, 'scheduler_type': 'plateau'}. Best is trial 0 with value: 0.6505031752161646.[0m
  [Trial 012] value=0.6390
[32m[I 2026-08-23 08:54:37,986][0m Trial 13 finished with value: 0.6470070886008273 and parameters: {'dropout': 0.6474121856356426, 'hidden_size': 144, 'num_layers': 6, 'use_attention': False, 'lr': 0.0003912081803212897, 'weight_decay': 3.575051892429363e-05, 'l1_lambda': 2.815135835003321e-08, 'gradient_clip': 4.819467442713943, 'loss_type': 'focal', 'focal_gamma': 1.6234550568090025, 'optimizer_type': 'adamw', 'momentum': 0.8823481879696575, 'scheduler_type': 'plateau'}. Best is trial 0 with value: 0.6505031752161646.[0m
  [Trial 013] value=0.6470
[32m[I 2026-08-23 08:55:52,972][0m Trial 14 finished with value: 0.6449499100695104 and parameters: {'dropout': 0.6694470525184963, 'hidden_size': 201, 'num_layers': 8, 'use_attention': False, 'lr': 0.0002208217421768419, 'weight_decay': 8.967663830627777e-06, 'l1_lambda': 1.4723940635193712e-08, 'gradient_clip': 3.3863239848355042, 'loss_type': 'focal', 'focal_gamma': 1.6837894972717835, 'optimizer_type': 'adamw', 'momentum': 0.8679908198952214, 'scheduler_type': 'cosine'}. Best is trial 0 with value: 0.6505031752161646.[0m
  [Trial 014] value=0.6449
[32m[I 2026-08-23 08:56:25,418][0m Trial 15 finished with value: 0.645109513678237 and parameters: {'dropout': 0.5719304630057689, 'hidden_size': 32, 'num_layers': 5, 'use_attention': False, 'lr': 0.0021661468883973477, 'weight_decay': 2.192129264792369e-05, 'l1_lambda': 2.2962675693131705e-06, 'gradient_clip': 4.517721266857606, 'loss_type': 'focal', 'focal_gamma': 2.682837972167759, 'optimizer_type': 'adamw', 'momentum': 0.8834686524617111, 'scheduler_type': 'plateau'}. Best is trial 0 with value: 0.6505031752161646.[0m
  [Trial 015] value=0.6451
[32m[I 2026-08-23 08:57:08,343][0m Trial 16 finished with value: 0.5384165039301302 and parameters: {'dropout': 0.5877039747443082, 'hidden_size': 99, 'num_layers': 7, 'use_attention': False, 'lr': 6.26103497775681e-05, 'weight_decay': 5.181923453604468e-06, 'l1_lambda': 0.001815577200332577, 'gradient_clip': 3.9445558266858076, 'loss_type': 'focal', 'focal_gamma': 1.6304746229911842, 'optimizer_type': 'adamw', 'momentum': 0.9441951746967863, 'scheduler_type': 'plateau'}. Best is trial 0 with value: 0.6505031752161646.[0m
  [Trial 016] value=0.5384
[32m[I 2026-08-23 08:58:14,372][0m Trial 17 finished with value: 0.6501227031309313 and parameters: {'dropout': 0.6909367032677252, 'hidden_size': 167, 'num_layers': 7, 'use_attention': False, 'lr': 0.0002857441470444086, 'weight_decay': 0.00028879961215506536, 'l1_lambda': 3.937136713203591e-08, 'gradient_clip': 3.27882917524348, 'loss_type': 'focal', 'focal_gamma': 2.86109349694394, 'optimizer_type': 'adamw', 'momentum': 0.8264811726016869, 'scheduler_type': 'cosine'}. Best is trial 0 with value: 0.6505031752161646.[0m
  [Trial 017] value=0.6501
[32m[I 2026-08-23 08:58:46,339][0m Trial 18 finished with value: 0.030151198099384078 and parameters: {'dropout': 0.5229979818675344, 'hidden_size': 315, 'num_layers': 8, 'use_attention': False, 'lr': 5.1549513238448307e-05, 'weight_decay': 0.0005083365393349109, 'l1_lambda': 9.675639079217778e-08, 'gradient_clip': 3.1037052030321144, 'loss_type': 'ce', 'focal_gamma': 2.949367709693222, 'optimizer_type': 'sgd', 'momentum': 0.8152857945845835, 'scheduler_type': 'cosine'}. Best is trial 0 with value: 0.6505031752161646.[0m
  [Trial 018] value=0.0302
[32m[I 2026-08-23 08:58:59,690][0m Trial 19 finished with value: 0.6357783564440322 and parameters: {'dropout': 0.6978882486607519, 'hidden_size': 48, 'num_layers': 1, 'use_attention': False, 'lr': 0.00021574873884082908, 'weight_decay': 0.013643808537068286, 'l1_lambda': 3.133215323330326e-06, 'gradient_clip': 2.7758324363445372, 'loss_type': 'focal', 'focal_gamma': 4.136195968160573, 'optimizer_type': 'adamw', 'momentum': 0.7662718939306022, 'scheduler_type': 'cosine'}. Best is trial 0 with value: 0.6505031752161646.[0m
  [Trial 019] value=0.6358
