[32m[I 2026-08-23 06:53:37,973][0m Trial 7 finished with value: 0.6259647231593546 and parameters: {'dropout': 0.3512674876110905, 'hidden_size': 281, 'num_layers': 2, 'bidirectional': False, 'use_attention': True, 'lr': 0.00020356877011104435, 'weight_decay': 4.423548579903847e-05, 'l1_lambda': 0.00025715974406654874, 'gradient_clip': 3.7784903539767876, 'loss_type': 'ce', 'focal_gamma': 1.674010873932951, 'optimizer_type': 'rmsprop', 'momentum': 0.7811814444323835, 'scheduler_type': 'cosine'}. Best is trial 1 with value: 0.6519980945725803.[0m
  [Trial 007] value=0.6260
[32m[I 2026-08-23 06:53:59,625][0m Trial 8 finished with value: 0.0 and parameters: {'dropout': 0.6126518631072114, 'hidden_size': 34, 'num_layers': 10, 'bidirectional': False, 'use_attention': False, 'lr': 0.04374824530397152, 'weight_decay': 0.02874323182952567, 'l1_lambda': 8.33395345179914e-08, 'gradient_clip': 3.545521189420802, 'loss_type': 'focal', 'focal_gamma': 3.6638989754240705, 'optimizer_type': 'adamw', 'momentum': 0.8683749124381959, 'scheduler_type': 'plateau'}. Best is trial 1 with value: 0.6519980945725803.[0m
  [Trial 008] value=0.0000
[32m[I 2026-08-23 06:54:28,864][0m Trial 9 finished with value: 0.0 and parameters: {'dropout': 0.2178001459485971, 'hidden_size': 362, 'num_layers': 8, 'bidirectional': False, 'use_attention': True, 'lr': 0.006375236775331462, 'weight_decay': 1.7684304377160492e-07, 'l1_lambda': 1.2312390095016444e-07, 'gradient_clip': 2.292639157577229, 'loss_type': 'focal', 'focal_gamma': 1.2992228420162593, 'optimizer_type': 'rmsprop', 'momentum': 0.7035157198838846, 'scheduler_type': 'cosine'}. Best is trial 1 with value: 0.6519980945725803.[0m
  [Trial 009] value=0.0000
[32m[I 2026-08-23 06:54:49,363][0m Trial 10 finished with value: 0.4387973113602964 and parameters: {'dropout': 0.30125413268909074, 'hidden_size': 89, 'num_layers': 4, 'bidirectional': True, 'use_attention': True, 'lr': 0.000589794711819621, 'weight_decay': 6.062052293743419e-06, 'l1_lambda': 0.008180955636088972, 'gradient_clip': 4.966085350713531, 'loss_type': 'ce', 'focal_gamma': 2.7827692716037284, 'optimizer_type': 'sgd', 'momentum': 0.9898707370711617, 'scheduler_type': 'cosine'}. Best is trial 1 with value: 0.6519980945725803.[0m
  [Trial 010] value=0.4388
[32m[I 2026-08-23 06:55:30,477][0m Trial 11 finished with value: 0.6315686820523282 and parameters: {'dropout': 0.06013791626093795, 'hidden_size': 496, 'num_layers': 1, 'bidirectional': True, 'use_attention': True, 'lr': 5.6826154911806826e-05, 'weight_decay': 2.87116240469006e-05, 'l1_lambda': 7.791296315540036e-05, 'gradient_clip': 3.3335395146766946, 'loss_type': 'ce', 'focal_gamma': 2.8461366499723892, 'optimizer_type': 'adamw', 'momentum': 0.7919099728362818, 'scheduler_type': 'cosine'}. Best is trial 1 with value: 0.6519980945725803.[0m
  [Trial 011] value=0.6316
[32m[I 2026-08-23 06:55:55,460][0m Trial 12 finished with value: 0.6268026690239463 and parameters: {'dropout': 0.06109689252767007, 'hidden_size': 80, 'num_layers': 1, 'bidirectional': True, 'use_attention': True, 'lr': 8.657092765483605e-05, 'weight_decay': 2.6446945817769862e-05, 'l1_lambda': 2.1137623971557753e-05, 'gradient_clip': 2.9964590051646227, 'loss_type': 'ce', 'focal_gamma': 2.864817281832503, 'optimizer_type': 'adamw', 'momentum': 0.817452007622592, 'scheduler_type': 'cosine'}. Best is trial 1 with value: 0.6519980945725803.[0m
  [Trial 012] value=0.6268
[32m[I 2026-08-23 06:57:55,308][0m Trial 13 finished with value: 0.6450104945883136 and parameters: {'dropout': 0.07528721589568582, 'hidden_size': 532, 'num_layers': 4, 'bidirectional': True, 'use_attention': True, 'lr': 0.0014172356916868324, 'weight_decay': 0.0014736760284671728, 'l1_lambda': 5.230115222434925e-06, 'gradient_clip': 3.1256109773040714, 'loss_type': 'ce', 'focal_gamma': 3.289755606737186, 'optimizer_type': 'adamw', 'momentum': 0.9008419556979521, 'scheduler_type': 'cosine'}. Best is trial 1 with value: 0.6519980945725803.[0m
  [Trial 013] value=0.6450
[32m[I 2026-08-23 06:58:51,912][0m Trial 14 finished with value: 0.6526901451543399 and parameters: {'dropout': 0.480566676142429, 'hidden_size': 483, 'num_layers': 4, 'bidirectional': True, 'use_attention': True, 'lr': 0.0015742618386115354, 'weight_decay': 0.001905739216988522, 'l1_lambda': 3.404966014318359e-06, 'gradient_clip': 4.4284782810524455, 'loss_type': 'ce', 'focal_gamma': 4.950822486724235, 'optimizer_type': 'adamw', 'momentum': 0.8945679174353742, 'scheduler_type': 'cosine'}. Best is trial 14 with value: 0.6526901451543399.[0m
  [Trial 014] value=0.6527
[32m[I 2026-08-23 07:05:08,782][0m Trial 15 finished with value: 0.6310003021904006 and parameters: {'dropout': 0.4914202626312734, 'hidden_size': 873, 'num_layers': 5, 'bidirectional': True, 'use_attention': True, 'lr': 0.0016459428783446018, 'weight_decay': 0.0026738993628619458, 'l1_lambda': 1.0915033090506097e-06, 'gradient_clip': 4.396606746282232, 'loss_type': 'ce', 'focal_gamma': 4.938007891165588, 'optimizer_type': 'adamw', 'momentum': 0.888578948683623, 'scheduler_type': 'cosine'}. Best is trial 14 with value: 0.6526901451543399.[0m
  [Trial 015] value=0.6310
[32m[I 2026-08-23 07:05:45,362][0m Trial 16 finished with value: 0.6566142411141374 and parameters: {'dropout': 0.5131531443630616, 'hidden_size': 137, 'num_layers': 4, 'bidirectional': True, 'use_attention': True, 'lr': 0.0017192472715912436, 'weight_decay': 0.00021016761470071926, 'l1_lambda': 1.1293917288222265e-08, 'gradient_clip': 4.377016409148058, 'loss_type': 'ce', 'focal_gamma': 4.836741642582679, 'optimizer_type': 'adamw', 'momentum': 0.9454590080079562, 'scheduler_type': 'cosine'}. Best is trial 16 with value: 0.6566142411141374.[0m
  [Trial 016] value=0.6566
[32m[I 2026-08-23 07:06:10,192][0m Trial 17 finished with value: 0.5755284187618095 and parameters: {'dropout': 0.5301187834440456, 'hidden_size': 118, 'num_layers': 3, 'bidirectional': True, 'use_attention': True, 'lr': 0.0017525115808474073, 'weight_decay': 0.003825878626459528, 'l1_lambda': 0.005292184264399073, 'gradient_clip': 1.4319230316315659, 'loss_type': 'ce', 'focal_gamma': 4.762230953806093, 'optimizer_type': 'sgd', 'momentum': 0.9590645350516793, 'scheduler_type': 'cosine'}. Best is trial 16 with value: 0.6566142411141374.[0m
  [Trial 017] value=0.5755
[32m[I 2026-08-23 07:07:03,979][0m Trial 18 finished with value: 0.6506356977009674 and parameters: {'dropout': 0.5314424759217584, 'hidden_size': 310, 'num_layers': 4, 'bidirectional': True, 'use_attention': False, 'lr': 0.00269485982320839, 'weight_decay': 0.00028046103935016844, 'l1_lambda': 1.5649398458605255e-08, 'gradient_clip': 4.467662052780872, 'loss_type': 'ce', 'focal_gamma': 4.5762574103083695, 'optimizer_type': 'adamw', 'momentum': 0.8272227937409803, 'scheduler_type': 'cosine'}. Best is trial 16 with value: 0.6566142411141374.[0m
  [Trial 018] value=0.6506
[32m[I 2026-08-23 07:08:35,017][0m Trial 19 finished with value: 0.6576205897643709 and parameters: {'dropout': 0.43244810650439625, 'hidden_size': 483, 'num_layers': 3, 'bidirectional': True, 'use_attention': True, 'lr': 0.0008084837972976048, 'weight_decay': 0.005831368225973764, 'l1_lambda': 1.3617189713073561e-08, 'gradient_clip': 4.498909748861338, 'loss_type': 'ce', 'focal_gamma': 3.983309097402372, 'optimizer_type': 'adamw', 'momentum': 0.87699257969375, 'scheduler_type': 'cosine'}. Best is trial 19 with value: 0.6576205897643709.[0m
  [Trial 019] value=0.6576
[32m[I 2026-08-23 07:09:00,055][0m Trial 20 finished with value: 0.6063233349562074 and parameters: {'dropout': 0.27099306262351247, 'hidden_size': 202, 'num_layers': 2, 'bidirectional': True, 'use_attention': True, 'lr': 0.0008489847806656327, 'weight_decay': 4.351483090861952e-06, 'l1_lambda': 2.0811508424504518e-08, 'gradient_clip': 2.6648398132807474, 'loss_type': 'ce', 'focal_gamma': 3.9110982454219547, 'optimizer_type': 'sgd', 'momentum': 0.8612318728466616, 'scheduler_type': 'cosine'}. Best is trial 19 with value: 0.6576205897643709.[0m
  [Trial 020] value=0.6063
[32m[I 2026-08-23 07:10:09,578][0m Trial 21 finished with value: 0.6397760601681503 and parameters: {'dropout': 0.43472645690729794, 'hidden_size': 524, 'num_layers': 3, 'bidirectional': True, 'use_attention': True, 'lr': 0.0008991648258528713, 'weight_decay': 0.006595998080591343, 'l1_lambda': 1.0100782238184006e-08, 'gradient_clip': 4.4752537194317865, 'loss_type': 'ce', 'focal_gamma': 4.887313758787672, 'optimizer_type': 'adamw', 'momentum': 0.8859285103055582, 'scheduler_type': 'cosine'}. Best is trial 19 with value: 0.6576205897643709.[0m
  [Trial 021] value=0.6398
[32m[I 2026-08-23 07:11:24,950][0m Trial 22 finished with value: 0.0 and parameters: {'dropout': 0.5562412512192352, 'hidden_size': 631, 'num_layers': 5, 'bidirectional': True, 'use_attention': True, 'lr': 0.0036015623649572437, 'weight_decay': 0.0001725240996888419, 'l1_lambda': 0.0008327837186113131, 'gradient_clip': 4.64198100614364, 'loss_type': 'ce', 'focal_gamma': 4.5151388768513065, 'optimizer_type': 'adamw', 'momentum': 0.9471918855005755, 'scheduler_type': 'cosine'}. Best is trial 19 with value: 0.6576205897643709.[0m
  [Trial 022] value=0.0000
[32m[I 2026-08-23 07:11:52,994][0m Trial 23 finished with value: 0.6312003205109633 and parameters: {'dropout': 0.41277650532042787, 'hidden_size': 404, 'num_layers': 2, 'bidirectional': True, 'use_attention': True, 'lr': 0.00023454815543366334, 'weight_decay': 0.09888202320977861, 'l1_lambda': 8.540139309301046e-07, 'gradient_clip': 4.255149379443913, 'loss_type': 'ce', 'focal_gamma': 3.994207328393644, 'optimizer_type': 'adamw', 'momentum': 0.9102335116278844, 'scheduler_type': 'cosine'}. Best is trial 19 with value: 0.6576205897643709.[0m
  [Trial 023] value=0.6312
[32m[I 2026-08-23 07:12:27,250][0m Trial 24 finished with value: 0.6398132425945332 and parameters: {'dropout': 0.46487493562708415, 'hidden_size': 252, 'num_layers': 4, 'bidirectional': True, 'use_attention': True, 'lr': 0.0023106772266022284, 'weight_decay': 0.0011351766785863417, 'l1_lambda': 3.5619685513295924e-08, 'gradient_clip': 3.570812455080433, 'loss_type': 'ce', 'focal_gamma': 4.58468052316935, 'optimizer_type': 'adamw', 'momentum': 0.822596829589254, 'scheduler_type': 'cosine'}. Best is trial 19 with value: 0.6576205897643709.[0m
  [Trial 024] value=0.6398
[32m[I 2026-08-23 07:13:28,457][0m Trial 25 finished with value: 0.6438864309127404 and parameters: {'dropout': 0.5712631792384899, 'hidden_size': 146, 'num_layers': 5, 'bidirectional': True, 'use_attention': True, 'lr': 0.001014340117015813, 'weight_decay': 0.0073344258327458145, 'l1_lambda': 3.068987916650613e-05, 'gradient_clip': 4.9583134606981805, 'loss_type': 'ce', 'focal_gamma': 4.955713138341371, 'optimizer_type': 'adamw', 'momentum': 0.8850085263550551, 'scheduler_type': 'cosine'}. Best is trial 19 with value: 0.6576205897643709.[0m
  [Trial 025] value=0.6439
[32m[I 2026-08-23 07:19:59,353][0m Trial 26 finished with value: 0.6145789629795242 and parameters: {'dropout': 0.38694942470033117, 'hidden_size': 962, 'num_layers': 3, 'bidirectional': True, 'use_attention': False, 'lr': 0.018641816098843512, 'weight_decay': 0.0006601145222343846, 'l1_lambda': 4.765549503513483e-07, 'gradient_clip': 4.1604614516422, 'loss_type': 'ce', 'focal_gamma': 4.0418656224310405, 'optimizer_type': 'adamw', 'momentum': 0.9886449516102035, 'scheduler_type': 'plateau'}. Best is trial 19 with value: 0.6576205897643709.[0m
  [Trial 026] value=0.6146
[32m[I 2026-08-23 07:20:52,777][0m Trial 27 finished with value: 0.6330623126654262 and parameters: {'dropout': 0.31629783881990425, 'hidden_size': 413, 'num_layers': 2, 'bidirectional': True, 'use_attention': True, 'lr': 0.0002628943928524924, 'weight_decay': 0.010034769633009841, 'l1_lambda': 2.1031508276943663e-06, 'gradient_clip': 4.681343409584281, 'loss_type': 'ce', 'focal_gamma': 3.328075737160343, 'optimizer_type': 'adamw', 'momentum': 0.943532554197699, 'scheduler_type': 'cosine'}. Best is trial 19 with value: 0.6576205897643709.[0m
  [Trial 027] value=0.6331
[32m[I 2026-08-23 07:22:47,784][0m Trial 28 finished with value: 0.5577230935380205 and parameters: {'dropout': 0.4967628325114927, 'hidden_size': 682, 'num_layers': 4, 'bidirectional': True, 'use_attention': True, 'lr': 0.002947524595506209, 'weight_decay': 0.00011080442127135206, 'l1_lambda': 3.370972163126029e-08, 'gradient_clip': 1.7996915034709744, 'loss_type': 'ce', 'focal_gamma': 4.338592899837379, 'optimizer_type': 'sgd', 'momentum': 0.8403693320226244, 'scheduler_type': 'cosine'}. Best is trial 19 with value: 0.6576205897643709.[0m
  [Trial 028] value=0.5577
[32m[I 2026-08-23 07:25:02,209][0m Trial 29 finished with value: 0.6503168579253699 and parameters: {'dropout': 0.43937268285440595, 'hidden_size': 228, 'num_layers': 7, 'bidirectional': True, 'use_attention': True, 'lr': 0.004322841918533774, 'weight_decay': 0.0005948558101321139, 'l1_lambda': 9.46778383451064e-08, 'gradient_clip': 3.789875174726654, 'loss_type': 'ce', 'focal_gamma': 2.5504744370246186, 'optimizer_type': 'adamw', 'momentum': 0.9090530449307501, 'scheduler_type': 'plateau'}. Best is trial 19 with value: 0.6576205897643709.[0m
  [Trial 029] value=0.6503
[32m[I 2026-08-23 07:28:59,101][0m Trial 0 finished with value: 0.614539826374586 and parameters: {'dropout': 0.573277727500358, 'num_filters': 150, 'num_blocks': 12, 'kernel_set': 2, 'lr': 0.019369504542872465, 'weight_decay': 0.001153031252712393, 'l1_lambda': 1.9100302007321378e-08, 'gradient_clip': 3.8039270139139605, 'loss_type': 'ce', 'focal_gamma': 2.4709249904079593, 'optimizer_type': 'rmsprop', 'momentum': 0.8981172618813316, 'scheduler_type': 'cosine'}. Best is trial 0 with value: 0.614539826374586.[0m
  [Trial 000] value=0.6145
[32m[I 2026-08-23 07:30:13,903][0m Trial 1 finished with value: 0.6401473091955987 and parameters: {'dropout': 0.14008193262866375, 'num_filters': 237, 'num_blocks': 7, 'kernel_set': 0, 'lr': 0.0004532127552967752, 'weight_decay': 1.0821218889053408e-05, 'l1_lambda': 7.579467197279517e-07, 'gradient_clip': 2.0867515516828794, 'loss_type': 'ce', 'focal_gamma': 2.5558930037815983, 'optimizer_type': 'sgd', 'momentum': 0.7480058589697927, 'scheduler_type': 'cosine'}. Best is trial 1 with value: 0.6401473091955987.[0m
  [Trial 001] value=0.6401
[32m[I 2026-08-23 07:30:53,904][0m Trial 2 finished with value: 0.6334324249014237 and parameters: {'dropout': 0.237276920338527, 'num_filters': 485, 'num_blocks': 4, 'kernel_set': 3, 'lr': 6.737406092252684e-05, 'weight_decay': 6.536844535166578e-06, 'l1_lambda': 1.478560466416398e-07, 'gradient_clip': 0.9183985833572146, 'loss_type': 'ce', 'focal_gamma': 4.424118593298489, 'optimizer_type': 'rmsprop', 'momentum': 0.7003533000621575, 'scheduler_type': 'plateau'}. Best is trial 1 with value: 0.6401473091955987.[0m
  [Trial 002] value=0.6334
[32m[I 2026-08-23 07:32:36,902][0m Trial 3 finished with value: 0.6328059797223478 and parameters: {'dropout': 0.1508448447046705, 'num_filters': 61, 'num_blocks': 12, 'kernel_set': 1, 'lr': 0.01130225235503339, 'weight_decay': 2.082982898451859e-05, 'l1_lambda': 3.4622557379027226e-08, 'gradient_clip': 4.527487325187559, 'loss_type': 'focal', 'focal_gamma': 3.2587967403110696, 'optimizer_type': 'rmsprop', 'momentum': 0.8290867792000645, 'scheduler_type': 'cosine'}. Best is trial 1 with value: 0.6401473091955987.[0m
  [Trial 003] value=0.6328
[32m[I 2026-08-23 07:34:37,766][0m Trial 4 finished with value: 0.6251993679239195 and parameters: {'dropout': 0.09531381135220693, 'num_filters': 110, 'num_blocks': 16, 'kernel_set': 3, 'lr': 0.013782847165325358, 'weight_decay': 0.02979126925389467, 'l1_lambda': 0.00326610308573486, 'gradient_clip': 1.6048549821025464, 'loss_type': 'ce', 'focal_gamma': 3.4292377792623014, 'optimizer_type': 'sgd', 'momentum': 0.9062092482027178, 'scheduler_type': 'plateau'}. Best is trial 1 with value: 0.6401473091955987.[0m
  [Trial 004] value=0.6252
[32m[I 2026-08-23 07:36:52,412][0m Trial 5 finished with value: 0.6189844179567601 and parameters: {'dropout': 0.17066114787161044, 'num_filters': 807, 'num_blocks': 4, 'kernel_set': 0, 'lr': 0.00010008833064358424, 'weight_decay': 0.005328605537616422, 'l1_lambda': 3.278581686915393e-07, 'gradient_clip': 0.7487018983333686, 'loss_type': 'ce', 'focal_gamma': 2.879959420622998, 'optimizer_type': 'sgd', 'momentum': 0.7830727663059277, 'scheduler_type': 'plateau'}. Best is trial 1 with value: 0.6401473091955987.[0m
  [Trial 005] value=0.6190
[32m[I 2026-08-23 07:37:16,156][0m Trial 6 finished with value: 0.6429657590971082 and parameters: {'dropout': 0.6096602835523759, 'num_filters': 213, 'num_blocks': 1, 'kernel_set': 0, 'lr': 0.00027715137613062654, 'weight_decay': 5.024750842657396e-05, 'l1_lambda': 1.3605659685405775e-08, 'gradient_clip': 2.728972030663127, 'loss_type': 'focal', 'focal_gamma': 3.862901152064096, 'optimizer_type': 'adamw', 'momentum': 0.7119990224249518, 'scheduler_type': 'plateau'}. Best is trial 6 with value: 0.6429657590971082.[0m
  [Trial 006] value=0.6430
[32m[I 2026-08-23 07:39:51,417][0m Trial 7 finished with value: 0.580842465138318 and parameters: {'dropout': 0.28311706470857384, 'num_filters': 207, 'num_blocks': 12, 'kernel_set': 3, 'lr': 0.0007016509420833829, 'weight_decay': 1.625336277042209e-07, 'l1_lambda': 8.171606532950069e-06, 'gradient_clip': 0.6664809824146971, 'loss_type': 'focal', 'focal_gamma': 2.5023430588525923, 'optimizer_type': 'sgd', 'momentum': 0.7654106123026558, 'scheduler_type': 'plateau'}. Best is trial 6 with value: 0.6429657590971082.[0m
  [Trial 007] value=0.5808
[32m[I 2026-08-23 07:40:19,853][0m Trial 8 finished with value: 0.6319745439544354 and parameters: {'dropout': 0.34394648876050715, 'num_filters': 159, 'num_blocks': 4, 'kernel_set': 3, 'lr': 0.018572550084409077, 'weight_decay': 1.2483942200459643e-05, 'l1_lambda': 0.0003116139269272798, 'gradient_clip': 1.0444365653780392, 'loss_type': 'ce', 'focal_gamma': 2.685610794442788, 'optimizer_type': 'sgd', 'momentum': 0.9251821831439466, 'scheduler_type': 'plateau'}. Best is trial 6 with value: 0.6429657590971082.[0m
  [Trial 008] value=0.6320
[32m[I 2026-08-23 07:41:29,281][0m Trial 9 finished with value: 0.6377996584999358 and parameters: {'dropout': 0.44423805446144526, 'num_filters': 409, 'num_blocks': 8, 'kernel_set': 3, 'lr': 0.000811021607345722, 'weight_decay': 7.287189752124358e-05, 'l1_lambda': 3.5617598692552356e-05, 'gradient_clip': 0.5100339893905153, 'loss_type': 'focal', 'focal_gamma': 4.525831440388085, 'optimizer_type': 'adamw', 'momentum': 0.8252506088477062, 'scheduler_type': 'cosine'}. Best is trial 6 with value: 0.6429657590971082.[0m
  [Trial 009] value=0.6378
[32m[I 2026-08-23 07:41:52,060][0m Trial 10 finished with value: 0.6387885220660479 and parameters: {'dropout': 0.6623586461721667, 'num_filters': 33, 'num_blocks': 1, 'kernel_set': 0, 'lr': 0.003054605677144861, 'weight_decay': 3.2244645408233037e-07, 'l1_lambda': 4.165120972025406e-06, 'gradient_clip': 2.9792220440275856, 'loss_type': 'focal', 'focal_gamma': 1.4069904404550941, 'optimizer_type': 'adamw', 'momentum': 0.9788556035081826, 'scheduler_type': 'plateau'}. Best is trial 6 with value: 0.6429657590971082.[0m
  [Trial 010] value=0.6388
[32m[I 2026-08-23 07:42:18,180][0m Trial 11 finished with value: 0.6425393721061923 and parameters: {'dropout': 0.5053084282972498, 'num_filters': 303, 'num_blocks': 1, 'kernel_set': 0, 'lr': 0.00022294242511357922, 'weight_decay': 0.0004508783835324936, 'l1_lambda': 1.0291284415341758e-06, 'gradient_clip': 2.2889117508536576, 'loss_type': 'focal', 'focal_gamma': 3.849452067748923, 'optimizer_type': 'adamw', 'momentum': 0.7029481616183523, 'scheduler_type': 'cosine'}. Best is trial 6 with value: 0.6429657590971082.[0m
  [Trial 011] value=0.6425
[32m[I 2026-08-23 07:42:47,271][0m Trial 12 finished with value: 0.6259187319268881 and parameters: {'dropout': 0.5031447725930348, 'num_filters': 362, 'num_blocks': 1, 'kernel_set': 0, 'lr': 0.00020769020706950985, 'weight_decay': 0.0005476279425632949, 'l1_lambda': 1.0187922273138865e-08, 'gradient_clip': 2.769594192722325, 'loss_type': 'focal', 'focal_gamma': 4.118054083663576, 'optimizer_type': 'adamw', 'momentum': 0.71008916847892, 'scheduler_type': 'cosine'}. Best is trial 6 with value: 0.6429657590971082.[0m
  [Trial 012] value=0.6259
[32m[I 2026-08-23 07:43:16,921][0m Trial 13 finished with value: 0.643738903566273 and parameters: {'dropout': 0.6850444730730101, 'num_filters': 611, 'num_blocks': 1, 'kernel_set': 0, 'lr': 0.0002223633858374397, 'weight_decay': 0.0003118345608532532, 'l1_lambda': 2.381867391066537e-06, 'gradient_clip': 3.439471060820275, 'loss_type': 'focal', 'focal_gamma': 4.979629501831418, 'optimizer_type': 'adamw', 'momentum': 0.7384496274713398, 'scheduler_type': 'cosine'}. Best is trial 13 with value: 0.643738903566273.[0m
  [Trial 013] value=0.6437
[32m[I 2026-08-23 07:45:20,218][0m Trial 14 finished with value: 0.6283159786599634 and parameters: {'dropout': 0.6986111498462971, 'num_filters': 889, 'num_blocks': 6, 'kernel_set': 2, 'lr': 0.0023710453849994733, 'weight_decay': 1.734513114295655e-06, 'l1_lambda': 0.00014698291392906923, 'gradient_clip': 3.759803051122168, 'loss_type': 'focal', 'focal_gamma': 4.941695638131456, 'optimizer_type': 'adamw', 'momentum': 0.7888032963536302, 'scheduler_type': 'cosine'}. Best is trial 13 with value: 0.643738903566273.[0m
  [Trial 014] value=0.6283
